gender, first_name, last_name, full_name
male, TODD, RENKE, TODD RENKE
female, BRITTANIE, GINCHEREAU, BRITTANIE GINCHEREAU
male, DARRIAN, ELIXSON, DARRIAN ELIXSON
female, TANISHA, MAZALEWSKI, TANISHA MAZALEWSKI
male, WAYLAND, MUCH, WAYLAND MUCH
female, JEWELL, SOROS, JEWELL SOROS
male, BRAYAN, SCHIFFMAN, BRAYAN SCHIFFMAN
female, DAVID, KNOKE, DAVID KNOKE
male, HOWARD, COUTCHER, HOWARD COUTCHER
female, BRYNN, ESCANDON, BRYNN ESCANDON
male, WOODROW, KEIDERLING, WOODROW KEIDERLING
female, RENE, MACCHIO, RENE MACCHIO
male, YORK, HARRENSTEIN, YORK HARRENSTEIN
female, CLEM, HOMES, CLEM HOMES
male, JELANI, CEUS, JELANI CEUS
female, MARI, RECHTER, MARI RECHTER
male, ARTHER, JONS, ARTHER JONS
female, ISABELLE, LEMAHIEU, ISABELLE LEMAHIEU
male, YAAKOV, OBREY, YAAKOV OBREY
female, ELLIE, UDELL, ELLIE UDELL
male, DEMARION, HARTWAY, DEMARION HARTWAY
female, CHRISTA, BOOKHARDT, CHRISTA BOOKHARDT
male, FERDINAND, DUFNER, FERDINAND DUFNER
female, LUTIE, NOGUEZ, LUTIE NOGUEZ
male, KASH, ZACHRY, KASH ZACHRY
female, ROENA, HOLLIWAY, ROENA HOLLIWAY
male, TERRANCE, PFILE, TERRANCE PFILE
female, LEMPI, MESSNER, LEMPI MESSNER
male, NELS, EETEN, NELS EETEN
female, LATOSHA, BRINKMEYER, LATOSHA BRINKMEYER
male, JUSTUS, BOEHLE, JUSTUS BOEHLE
female, LURA, WEIHING, LURA WEIHING
male, CASS, PFORTMILLER, CASS PFORTMILLER
female, CHERYLL, TERNER, CHERYLL TERNER
male, TEGAN, BALDRIDGE, TEGAN BALDRIDGE
female, DARLA, BLAUM, DARLA BLAUM
male, ARCHIE, PALANZA, ARCHIE PALANZA
female, ETHELYN, ECKELBERG, ETHELYN ECKELBERG
male, YEE, CORDIN, YEE CORDIN
female, TAWANA, CLANEY, TAWANA CLANEY
male, UNNAMED, LITTLEPAGE, UNNAMED LITTLEPAGE
female, ADRIANE, LARRALDE, ADRIANE LARRALDE
male, CHRISTY, MACKLE, CHRISTY MACKLE
female, RENNIE, VESPER, RENNIE VESPER
male, RUEL, VATTEROTT, RUEL VATTEROTT
female, LESLY, ABBADESSA, LESLY ABBADESSA
male, EVERT, VIRELLI, EVERT VIRELLI
female, SHERYL, KONNICK, SHERYL KONNICK
male, RAYFORD, TRAKAS, RAYFORD TRAKAS
female, GLENNIE, LEPRI, GLENNIE LEPRI
male, ANTWAIN, VAAL, ANTWAIN VAAL
female, BRITT, WHELDON, BRITT WHELDON
male, JAQUAN, SOFIE, JAQUAN SOFIE
female, ERNESTINA, GULBRONSON, ERNESTINA GULBRONSON
male, HATTIE, RUFFINI, HATTIE RUFFINI
female, MINERVIA, LAFOUNTAIN, MINERVIA LAFOUNTAIN
male, JERREL, ABRANTES, JERREL ABRANTES
female, JANETTE, SALLOWS, JANETTE SALLOWS
male, CHRISTOPER, GESSERT, CHRISTOPER GESSERT
female, SYLVA, COULT, SYLVA COULT
male, SALOMON, GUADERRAMA, SALOMON GUADERRAMA
female, HALI, DAVILMAR, HALI DAVILMAR
male, COLVIN, MCPHARLIN, COLVIN MCPHARLIN
female, ERNESTINE, BILAND, ERNESTINE BILAND
male, OWEN, MEENA, OWEN MEENA
female, XENA, JUNIPER, XENA JUNIPER
male, CLAIRE, BALINO, CLAIRE BALINO
female, LOVEY, MONTEAGUDO, LOVEY MONTEAGUDO
male, MOE, GETTENS, MOE GETTENS
female, MARGENE, CARACHEO, MARGENE CARACHEO
male, THOR, KIRCHOFF, THOR KIRCHOFF
female, MELVA, OZMENT, MELVA OZMENT
male, MAVERICK, OBERHAUSER, MAVERICK OBERHAUSER
female, KATRINA, DACRE, KATRINA DACRE
male, ARCHIE, MONTELBANO, ARCHIE MONTELBANO
female, LORELAI, SHYMANSKI, LORELAI SHYMANSKI
male, BRANSON, ARLAND, BRANSON ARLAND
female, LILLIE, MAMARIL, LILLIE MAMARIL
male, KENDELL, MOELLENDORF, KENDELL MOELLENDORF
female, ISABELA, PETRICK, ISABELA PETRICK
male, LAMAR, MCBETH, LAMAR MCBETH
female, JULISA, JAMEISON, JULISA JAMEISON
male, JOB, LYBECK, JOB LYBECK
female, MARGERY, DEADRICK, MARGERY DEADRICK
male, DARRYLE, FEELEY, DARRYLE FEELEY
female, SOCORRO, KASSON, SOCORRO KASSON
male, SKYLAR, PAFFRATH, SKYLAR PAFFRATH
female, MADISON, MANGANARO, MADISON MANGANARO
male, JERREL, WILMERDING, JERREL WILMERDING
female, DAYANA, MEJIASANCHEZ, DAYANA MEJIASANCHEZ
male, BLANCHE, KEMPEN, BLANCHE KEMPEN
female, RASHIDA, RIRIE, RASHIDA RIRIE
male, MYRL, BURIN, MYRL BURIN
female, MARGARETTA, LOCKER, MARGARETTA LOCKER
male, DEION, EUM, DEION EUM
female, SARITA, BIDDLE, SARITA BIDDLE
male, HEZEKIAH, ALTERIO, HEZEKIAH ALTERIO
female, BEDA, LOUISMA, BEDA LOUISMA
male, CAYDEN, GAIBOR, CAYDEN GAIBOR
female, BERNARDINE, PULLARO, BERNARDINE PULLARO
male, SEWARD, PRADEEP, SEWARD PRADEEP
female, OPAL, DIMES, OPAL DIMES
male, SKIP, LILJEDAHL, SKIP LILJEDAHL
female, DICY, CLOTFELTER, DICY CLOTFELTER
male, LANNIE, STEHNO, LANNIE STEHNO
female, KEYLA, AMRINE, KEYLA AMRINE
male, ORVILLE, FALETOGO, ORVILLE FALETOGO
female, CHANEY, SLOTNICK, CHANEY SLOTNICK
male, RONIN, FOLSOM, RONIN FOLSOM
female, KRISTIN, BONOME, KRISTIN BONOME
male, MAURO, FABRIZI, MAURO FABRIZI
female, BRIGITTE, GIARDIELLO, BRIGITTE GIARDIELLO
male, LINTON, DIMASCIO, LINTON DIMASCIO
female, HORTENCIA, DOWNTON, HORTENCIA DOWNTON
male, JIMMY, TRICARICO, JIMMY TRICARICO
female, AMARA, JIMENEZ, AMARA JIMENEZ
male, LEIGHTON, EMERY, LEIGHTON EMERY
female, DOMINIQUE, FEDERLE, DOMINIQUE FEDERLE
male, DUNCAN, VIGOA, DUNCAN VIGOA
female, BEADIE, MENDEZRODRIGUE, BEADIE MENDEZRODRIGUE
male, ZANE, BENITEZGARCIA, ZANE BENITEZGARCIA
female, BEA, BARROR, BEA BARROR
male, ELBERT, HARE, ELBERT HARE
female, LILLIANNA, BRENA, LILLIANNA BRENA
male, DARELL, WORDELMAN, DARELL WORDELMAN
female, ASHLEY, TRACK, ASHLEY TRACK
male, PERLEY, FIELITZ, PERLEY FIELITZ
female, EMMY, SHALE, EMMY SHALE
male, SYED, KOBLE, SYED KOBLE
female, KAYLAN, IMPERIALE, KAYLAN IMPERIALE
male, ADRIEN, KINLOW, ADRIEN KINLOW
female, SLOANE, BOCKSTAHLER, SLOANE BOCKSTAHLER
male, SEAN, STRUWE, SEAN STRUWE
female, RACHAEL, SHEU, RACHAEL SHEU
male, SIMON, SANGUINET, SIMON SANGUINET
female, DORTHA, TAFELSKI, DORTHA TAFELSKI
male, LINDELL, KNETTEL, LINDELL KNETTEL
female, MELANY, BIRCH, MELANY BIRCH
male, MANUEL, CAPPELLI, MANUEL CAPPELLI
female, AYANNA, SERRITELLA, AYANNA SERRITELLA
male, VIRGEL, FLEER, VIRGEL FLEER
female, KATHERIN, WEINSHEIMER, KATHERIN WEINSHEIMER
male, DENNIE, PANACCIONE, DENNIE PANACCIONE
female, SANTA, SOFIELD, SANTA SOFIELD
male, DEMETRIOS, PISAREK, DEMETRIOS PISAREK
female, KAYLEN, FOUHY, KAYLEN FOUHY
male, URIJAH, GJONBALAJ, URIJAH GJONBALAJ
female, CHARITY, MADDERRA, CHARITY MADDERRA
male, ARNE, RAVIZZA, ARNE RAVIZZA
female, LAVERA, LOVAS, LAVERA LOVAS
male, KADYN, VOY, KADYN VOY
female, ROSENA, PURVEY, ROSENA PURVEY
male, EUGENIO, NOSSER, EUGENIO NOSSER
female, ORRA, TILLISON, ORRA TILLISON
male, BRAYLON, DOLBOW, BRAYLON DOLBOW
female, VERTIE, CONATSER, VERTIE CONATSER
male, SPURGEON, KULISH, SPURGEON KULISH
female, GABRIEL, MAGGERT, GABRIEL MAGGERT
male, HORTON, BORCKY, HORTON BORCKY
female, ALZINA, VANNICOLA, ALZINA VANNICOLA
male, HAL, AUWAE, HAL AUWAE
female, DELTA, LAUTERWASSER, DELTA LAUTERWASSER
male, FANNIE, BRIDENTHAL, FANNIE BRIDENTHAL
female, MENDY, KALOUDIS, MENDY KALOUDIS
male, DEAN, CZAR, DEAN CZAR
female, STELLA, IMLACH, STELLA IMLACH
male, KAIDEN, QUERIDO, KAIDEN QUERIDO
female, MACEY, ALOP, MACEY ALOP
male, ZIGMUND, CHEON, ZIGMUND CHEON
female, KASIE, ERLIKH, KASIE ERLIKH
male, JADIEL, BAUDIER, JADIEL BAUDIER
female, ERIE, WHITMEYER, ERIE WHITMEYER
male, CHERYL, BAZALAR, CHERYL BAZALAR
female, ALANI, GRANDIZIO, ALANI GRANDIZIO
male, TEDDIE, STICKFORT, TEDDIE STICKFORT
female, HONORA, MALINOSKY, HONORA MALINOSKY
male, ELIEZER, DUPES, ELIEZER DUPES
female, CLORA, TRENTHAM, CLORA TRENTHAM
male, WELTON, BOHMER, WELTON BOHMER
female, JERRY, ZVARA, JERRY ZVARA
male, WINDELL, KAMMERDIENER, WINDELL KAMMERDIENER
female, ETHA, ETSITTY, ETHA ETSITTY
male, DEBORAH, GONZALEZNUNEZ, DEBORAH GONZALEZNUNEZ
female, ANGELINA, BENSCOTER, ANGELINA BENSCOTER
male, ALECK, LOPEZCASTRO, ALECK LOPEZCASTRO
female, ELOIS, LOGG, ELOIS LOGG
male, WAYNE, LASATER, WAYNE LASATER
female, PRISCILA, BRIEL, PRISCILA BRIEL
male, SHERRILL, GIANAKOPOULOS, SHERRILL GIANAKOPOULOS
female, ANGELIA, HARDBARGER, ANGELIA HARDBARGER
male, JAN, MODAFFERI, JAN MODAFFERI
female, LUDA, KOHNE, LUDA KOHNE
male, SANTIAGO, GAAS, SANTIAGO GAAS
female, GRETTA, SICARI, GRETTA SICARI
male, NORMAND, SINI, NORMAND SINI
female, SHAMEKA, MOHRHAUSER, SHAMEKA MOHRHAUSER
male, CASSIE, WEINGART, CASSIE WEINGART
female, DEBORA, ELLERD, DEBORA ELLERD
male, MAKAI, MORAIS, MAKAI MORAIS
female, BEVERLEE, VEITENHEIMER, BEVERLEE VEITENHEIMER
male, EZEQUIEL, MCARDLE, EZEQUIEL MCARDLE
female, ESTER, MIROSHNICHENKO, ESTER MIROSHNICHENKO
male, JAME, MAZE, JAME MAZE
female, MICHAL, AYVAR, MICHAL AYVAR
male, RALEIGH, DENNE, RALEIGH DENNE
female, JAYME, PREIMESBERGER, JAYME PREIMESBERGER
male, GARY, PROSPERO, GARY PROSPERO
female, MAKENA, AUKLAND, MAKENA AUKLAND
male, PAULINE, MEN, PAULINE MEN
female, ALMEDA, DALLIS, ALMEDA DALLIS
male, KORBIN, MICKLER, KORBIN MICKLER
female, VICKY, VERHINE, VICKY VERHINE
male, ROCKY, BALLEJO, ROCKY BALLEJO
female, KARLY, RIETMAN, KARLY RIETMAN
male, EZEQUIEL, GOYNES, EZEQUIEL GOYNES
female, LOUANNA, BRICKELL, LOUANNA BRICKELL
male, TORY, DELABRA, TORY DELABRA
female, ARLEY, ZIMBARDI, ARLEY ZIMBARDI
male, MARSHALL, SCHOEMEHL, MARSHALL SCHOEMEHL
female, CLARIBEL, GARAND, CLARIBEL GARAND
male, TRYSTAN, DICK, TRYSTAN DICK
female, BIRTIE, KEYMON, BIRTIE KEYMON
male, EVERT, OYOQUE, EVERT OYOQUE
female, DANIELLA, NANAYAKKARA, DANIELLA NANAYAKKARA
male, ENNIS, KEEZER, ENNIS KEEZER
female, MARGET, KANWISCHER, MARGET KANWISCHER
male, GORDON, FAUDE, GORDON FAUDE
female, KASSIDY, PICKELSIMER, KASSIDY PICKELSIMER
male, CARLETON, HANNES, CARLETON HANNES
female, FRIEDA, NIENDORF, FRIEDA NIENDORF
male, LUIGI, BENIGNO, LUIGI BENIGNO
female, DEMETRA, CUFFARO, DEMETRA CUFFARO
male, HANDY, KOP, HANDY KOP
female, TEELA, INFANTE, TEELA INFANTE
male, LEM, MCVITTIE, LEM MCVITTIE
female, ELLAMAE, OVA, ELLAMAE OVA
male, DEWAYNE, HARAMIS, DEWAYNE HARAMIS
female, VANNIE, DESVIGNES, VANNIE DESVIGNES
male, JUSTICE, CERTO, JUSTICE CERTO
female, DRUSILLA, VANNORT, DRUSILLA VANNORT
male, CAMPBELL, THUNE, CAMPBELL THUNE
female, CHLOIE, LEMMINGS, CHLOIE LEMMINGS
male, TAD, ROTNER, TAD ROTNER
female, ALEXANDREA, KOBOLD, ALEXANDREA KOBOLD
male, TORY, PEARTREE, TORY PEARTREE
female, DELANEY, LASKER, DELANEY LASKER
male, WEBB, KNAUBER, WEBB KNAUBER
female, JERRY, BELARDE, JERRY BELARDE
male, BRANDON, BENDINELLI, BRANDON BENDINELLI
female, LORINDA, PASTOOR, LORINDA PASTOOR
male, MARLAND, BITNER, MARLAND BITNER
female, LAUNA, EBBELER, LAUNA EBBELER
male, LEVIN, REINERT, LEVIN REINERT
female, CORDIA, MONKEN, CORDIA MONKEN
male, HOLLAND, GRAPHENTEEN, HOLLAND GRAPHENTEEN
female, MARGO, LANNIGAN, MARGO LANNIGAN
male, DESSIE, HALLING, DESSIE HALLING
female, MARGARITE, ANGELAKIS, MARGARITE ANGELAKIS
male, GERMAINE, TUTER, GERMAINE TUTER
female, ENRIQUETA, SHALAN, ENRIQUETA SHALAN
male, BEATRICE, ATCITTY, BEATRICE ATCITTY
female, CORAIMA, REGENT, CORAIMA REGENT
male, JARET, GAITERS, JARET GAITERS
female, HENNIE, SAVONA, HENNIE SAVONA
male, ZANDER, MARCHETTA, ZANDER MARCHETTA
female, ZOEY, DANIAL, ZOEY DANIAL
male, TATSUO, BEYALE, TATSUO BEYALE
female, DEBROAH, KOGLIN, DEBROAH KOGLIN
male, AUGUSTA, WEATHERFORD, AUGUSTA WEATHERFORD
female, YESSENIA, SALANI, YESSENIA SALANI
male, DEMOND, RUTIAGA, DEMOND RUTIAGA
female, MINTIE, KUMA, MINTIE KUMA
male, RYAN, GLASPY, RYAN GLASPY
female, POLLIE, MARCHITELLO, POLLIE MARCHITELLO
male, SHAMAR, PALMQUIST, SHAMAR PALMQUIST
female, LILLIANNA, BEANLAND, LILLIANNA BEANLAND
male, ANTOINE, WOJTYNA, ANTOINE WOJTYNA
female, REBECA, HER, REBECA HER
male, ERNIE, MARDY, ERNIE MARDY
female, KARIE, DELEO, KARIE DELEO
male, JENSEN, SCHURK, JENSEN SCHURK
female, KATHRYNE, HELMBOLD, KATHRYNE HELMBOLD
male, MANSON, EMBERY, MANSON EMBERY
female, TRACY, EBERSBERGER, TRACY EBERSBERGER
male, RUBEN, GYORFI, RUBEN GYORFI
female, HOLLIS, SPRINKLE, HOLLIS SPRINKLE
male, DEANDRE, ANAMARIA, DEANDRE ANAMARIA
female, MATIE, SIWIEC, MATIE SIWIEC
male, JESSE, CHEEVERS, JESSE CHEEVERS
female, VENA, EDGERTON, VENA EDGERTON
male, WORLEY, BECHEN, WORLEY BECHEN
female, NANNA, HEYSE, NANNA HEYSE
male, JUDD, ISHII, JUDD ISHII
female, NYA, CONSOLAZIO, NYA CONSOLAZIO
male, SCHUYLER, FONTI, SCHUYLER FONTI
female, CHYNA, FINDLAY, CHYNA FINDLAY
male, YAIR, ITOW, YAIR ITOW
female, ASHLEIGH, CAMPOLLO, ASHLEIGH CAMPOLLO
male, KIYOSHI, GAMARRO, KIYOSHI GAMARRO
female, ARACELY, GUISASOLA, ARACELY GUISASOLA
male, EZELL, FIERY, EZELL FIERY
female, KELLY, ZOLINSKI, KELLY ZOLINSKI
male, RORY, HES, RORY HES
female, JANELL, TABERS, JANELL TABERS
male, DECLAN, VANAMBERG, DECLAN VANAMBERG
female, LATASHA, BRIXEY, LATASHA BRIXEY
male, BRADLY, PAFF, BRADLY PAFF
female, JINNIE, VANNEY, JINNIE VANNEY
male, LIZZIE, MELLOH, LIZZIE MELLOH
female, DARYL, GUSCOTT, DARYL GUSCOTT
male, HERMAN, ORTMEIER, HERMAN ORTMEIER
female, IDA, RABOLD, IDA RABOLD
male, QUINT, LEVEN, QUINT LEVEN
female, VERNON, KOTARBA, VERNON KOTARBA
male, EMERSON, KEELAN, EMERSON KEELAN
female, INELL, PANFILI, INELL PANFILI
male, FITZGERALD, TIRONI, FITZGERALD TIRONI
female, TANIKA, ULASZEK, TANIKA ULASZEK
male, CLEMMIE, KLINGENSMITH, CLEMMIE KLINGENSMITH
female, LASHONDA, WAUGHTEL, LASHONDA WAUGHTEL
male, OLEY, FARIST, OLEY FARIST
female, NANCI, NONDORF, NANCI NONDORF
male, RYLAN, CUNNIUS, RYLAN CUNNIUS
female, KAYLA, WROBEL, KAYLA WROBEL
male, GARRISON, PHEA, GARRISON PHEA
female, THEODORA, GRISWOLD, THEODORA GRISWOLD
male, KEYSHAWN, MINNIEWEATHER, KEYSHAWN MINNIEWEATHER
female, VANNIE, GIAMPAOLO, VANNIE GIAMPAOLO
male, KADYN, BUTZER, KADYN BUTZER
female, LACIE, DONOWAY, LACIE DONOWAY
male, EINO, VANELLA, EINO VANELLA
female, VERSIE, BAGANZ, VERSIE BAGANZ
male, DEVONTAE, TAMIR, DEVONTAE TAMIR
female, ASTRID, CANELA, ASTRID CANELA
male, ZAIN, CANTELLA, ZAIN CANTELLA
female, ELFRIEDA, LOWREY, ELFRIEDA LOWREY
male, TERRENCE, KOSENKO, TERRENCE KOSENKO
female, ARTIE, ROGOTZKE, ARTIE ROGOTZKE
male, CHADRICK, MIGL, CHADRICK MIGL
female, BETHA, MOZELESKI, BETHA MOZELESKI
male, JERRELL, HERFINDAHL, JERRELL HERFINDAHL
female, ISADORA, DULAI, ISADORA DULAI
male, MARCELLO, TROTMAN, MARCELLO TROTMAN
female, LATOYIA, LOMU, LATOYIA LOMU
male, ALECK, CICORA, ALECK CICORA
female, KRISTIN, VANN, KRISTIN VANN
male, FRANCIS, HUTCHENS, FRANCIS HUTCHENS
female, PORTIA, DOLITTLE, PORTIA DOLITTLE
male, JOY, ALU, JOY ALU
female, NATALY, MIMMS, NATALY MIMMS
male, WILBERT, EBAN, WILBERT EBAN
female, IOLA, RESTREPO, IOLA RESTREPO
male, CLEMMIE, WAUN, CLEMMIE WAUN
female, NALLELY, PENNINGS, NALLELY PENNINGS
male, DESEAN, DOERFLINGER, DESEAN DOERFLINGER
female, NILDA, SOIK, NILDA SOIK
male, DEBRA, OELTJEN, DEBRA OELTJEN
female, MARLIE, GENUNG, MARLIE GENUNG
male, ART, CHALA, ART CHALA
female, RYANN, BELLARDINI, RYANN BELLARDINI
male, DUFF, DIETZMANN, DUFF DIETZMANN
female, LUZ, MONETA, LUZ MONETA
male, ELIE, POLIVKA, ELIE POLIVKA
female, SUSIE, FERREN, SUSIE FERREN
male, ANTWON, HEICHEL, ANTWON HEICHEL
female, DELISA, KONDIK, DELISA KONDIK
male, SCOTTIE, KATAUSKAS, SCOTTIE KATAUSKAS
female, ALLYSON, VALENTI, ALLYSON VALENTI
male, COOPER, GOTTO, COOPER GOTTO
female, KIMBERLIE, HEBBERD, KIMBERLIE HEBBERD
male, GRIFFIN, YORO, GRIFFIN YORO
female, ADELLE, PICADO, ADELLE PICADO
male, CONARD, FENCL, CONARD FENCL
female, ALLA, GUARINI, ALLA GUARINI
male, ATHA, SORANO, ATHA SORANO
female, MELVINA, GABET, MELVINA GABET
male, CLIDE, MARGESON, CLIDE MARGESON
female, MISSOURI, GIEFER, MISSOURI GIEFER
male, REASON, ERDEM, REASON ERDEM
female, ELLER, WELLINS, ELLER WELLINS
male, CAESAR, CARNABUCI, CAESAR CARNABUCI
female, GERTRUDE, VOEHRINGER, GERTRUDE VOEHRINGER
male, MILDRED, NEUBAUM, MILDRED NEUBAUM
female, CASEY, LIAPIS, CASEY LIAPIS
male, GLENN, EMMENDORFER, GLENN EMMENDORFER
female, NYLA, WOLDEN, NYLA WOLDEN
male, ARLAN, BELLIN, ARLAN BELLIN
female, ERIS, NEAGLE, ERIS NEAGLE
male, MARIANO, HOTALING, MARIANO HOTALING
female, JILLIAN, SLONINA, JILLIAN SLONINA
male, CEASAR, KERLE, CEASAR KERLE
female, MARLYN, MORGON, MARLYN MORGON
male, ADITYA, DELKE, ADITYA DELKE
female, LANA, SPRAGINS, LANA SPRAGINS
male, LENNIE, OVERLY, LENNIE OVERLY
female, CYNTHIA, GARCIATREJO, CYNTHIA GARCIATREJO
male, REGINAL, RAGSAC, REGINAL RAGSAC
female, KACEY, PAUOLE, KACEY PAUOLE
male, DORA, GUARRIELLO, DORA GUARRIELLO
female, CRYSTA, HAVICAN, CRYSTA HAVICAN
male, TILDEN, CALLIGARO, TILDEN CALLIGARO
female, OLIE, HEINLE, OLIE HEINLE
male, BUDDIE, GROHS, BUDDIE GROHS
female, CHARLENE, BECKY, CHARLENE BECKY
male, LOREN, LETELLIER, LOREN LETELLIER
female, LEITHA, CROSSER, LEITHA CROSSER
male, ALSTON, GUSEMAN, ALSTON GUSEMAN
female, TEELA, DEZA, TEELA DEZA
male, ESTHER, BARBAN, ESTHER BARBAN
female, ANGELE, ILG, ANGELE ILG
male, SCOTTY, PAWLING, SCOTTY PAWLING
female, TALIYAH, MUSTARI, TALIYAH MUSTARI
male, FELTON, KONG, FELTON KONG
female, LATOYA, FEIOCK, LATOYA FEIOCK
male, LEEROY, BRAZEAL, LEEROY BRAZEAL
female, ORRA, PHIPPIN, ORRA PHIPPIN
male, ISREAL, LEUBNER, ISREAL LEUBNER
female, MAREN, FRESCURA, MAREN FRESCURA
male, TANNER, LIBBERT, TANNER LIBBERT
female, MARGARETTE, GRANSBERRY, MARGARETTE GRANSBERRY
male, SHANNON, COGGER, SHANNON COGGER
female, BARBARA, SOBESKI, BARBARA SOBESKI
male, SELDON, TRIELOFF, SELDON TRIELOFF
female, LILLIANA, MASSAY, LILLIANA MASSAY
male, KENJI, WEVER, KENJI WEVER
female, KARI, YEARSLEY, KARI YEARSLEY
male, JEFFREY, SAMALOT, JEFFREY SAMALOT
female, KELSEY, ANTONIEWICZ, KELSEY ANTONIEWICZ
male, AIDAN, LALLOO, AIDAN LALLOO
female, EMERY, BENDLIN, EMERY BENDLIN
male, TAYLOR, UNCIANO, TAYLOR UNCIANO
female, DARLA, MCANANY, DARLA MCANANY
male, IRVEN, FERINGTON, IRVEN FERINGTON
female, ANIKA, CERCEDA, ANIKA CERCEDA
male, DAKOTAH, PETMECKY, DAKOTAH PETMECKY
female, KRYSTINA, KJELLAND, KRYSTINA KJELLAND
male, DWANE, FIDRYCH, DWANE FIDRYCH
female, KARSYN, SIEMONS, KARSYN SIEMONS
male, ADELARD, KRATTIGER, ADELARD KRATTIGER
female, VANNIE, SENERCHIA, VANNIE SENERCHIA
male, TRISTAN, MCQUILLEN, TRISTAN MCQUILLEN
female, EDEN, BOEMER, EDEN BOEMER
male, TORREY, MAYNER, TORREY MAYNER
female, DEBBIE, MANNILA, DEBBIE MANNILA
male, BURLEIGH, KOTOUCH, BURLEIGH KOTOUCH
female, OLIVE, HIRSHMAN, OLIVE HIRSHMAN
male, REILLY, SCUNGIO, REILLY SCUNGIO
female, MARGENE, TIPSORD, MARGENE TIPSORD
male, PRESS, LAEMMLE, PRESS LAEMMLE
female, LEESA, CHEATOM, LEESA CHEATOM
male, RUSS, HIGHTS, RUSS HIGHTS
female, MAYME, KATAUSKAS, MAYME KATAUSKAS
male, LUTHER, HOUZE, LUTHER HOUZE
female, LURLINE, KLUG, LURLINE KLUG
male, ROGELIO, PALADUGU, ROGELIO PALADUGU
female, ALEASE, MANIK, ALEASE MANIK
male, LISA, HEWGLEY, LISA HEWGLEY
female, DENESE, HARTEN, DENESE HARTEN
male, JADYN, BRAMBLEY, JADYN BRAMBLEY
female, IZETTA, PERSICHETTI, IZETTA PERSICHETTI
male, VIRGEL, TAGGART, VIRGEL TAGGART
female, GRACIELA, CABADING, GRACIELA CABADING
male, LEOPOLD, CORTAZAR, LEOPOLD CORTAZAR
female, AMIRA, POPOWITZ, AMIRA POPOWITZ
male, DERYL, KERCADO, DERYL KERCADO
female, JENA, WAFORD, JENA WAFORD
male, LOGAN, TUCSON, LOGAN TUCSON
female, LEANDRA, SCHLEMMER, LEANDRA SCHLEMMER
male, VERLIN, MOOTHART, VERLIN MOOTHART
female, MINA, OBAD, MINA OBAD
male, CLEMMIE, UHLIK, CLEMMIE UHLIK
female, CORINE, CUBAN, CORINE CUBAN
male, LAFE, SYDLOWSKI, LAFE SYDLOWSKI
female, MAKAILA, LEGATH, MAKAILA LEGATH
male, PLUMMER, DERDERIAN, PLUMMER DERDERIAN
female, MADISYN, MEDDINGS, MADISYN MEDDINGS
male, JOAQUIN, KUO, JOAQUIN KUO
female, BERNIECE, WERFEL, BERNIECE WERFEL
male, SANDRA, VOLLENTINE, SANDRA VOLLENTINE
female, JOELLA, PFANDER, JOELLA PFANDER
male, LENWOOD, CASTORINA, LENWOOD CASTORINA
female, DENISHA, SALANGA, DENISHA SALANGA
male, ROBERT, KAPING, ROBERT KAPING
female, AMIRAH, TERWILLEGER, AMIRAH TERWILLEGER
male, BENSON, BOYENS, BENSON BOYENS
female, BRITTANY, SAUNSOCI, BRITTANY SAUNSOCI
male, ODIE, WAMER, ODIE WAMER
female, BRITNY, FELMET, BRITNY FELMET
male, THADDEUS, VANSLOOTEN, THADDEUS VANSLOOTEN
female, HENRY, HANONO, HENRY HANONO
male, ELLWOOD, WRAITH, ELLWOOD WRAITH
female, PAYTON, MCCLURKIN, PAYTON MCCLURKIN
male, EDWARD, STEFANEC, EDWARD STEFANEC
female, CHESTER, CIMINELLO, CHESTER CIMINELLO
male, LORIN, MINGOIA, LORIN MINGOIA
female, CARLENE, PAPADAKOS, CARLENE PAPADAKOS
male, EUSTACE, PELISH, EUSTACE PELISH
female, ADELAIDE, DEJESUSGARCIA, ADELAIDE DEJESUSGARCIA
male, CLAUDIUS, UTZ, CLAUDIUS UTZ
female, EDITH, WANKET, EDITH WANKET
male, JAYDAN, PETKOVSEK, JAYDAN PETKOVSEK
female, HALEY, CONTRERASLOPEZ, HALEY CONTRERASLOPEZ
male, GERALD, STARKER, GERALD STARKER
female, ZOEY, MOENCK, ZOEY MOENCK
male, JAMARI, KRIPPEL, JAMARI KRIPPEL
female, ELENORA, LIMP, ELENORA LIMP
male, SHANE, RYCHLIK, SHANE RYCHLIK
female, AYLA, KALARIA, AYLA KALARIA
male, SAVON, SPEIRS, SAVON SPEIRS
female, ERLENE, HARTRIDGE, ERLENE HARTRIDGE
male, DAVIAN, BETTENHAUSEN, DAVIAN BETTENHAUSEN
female, VERDELL, BORGAN, VERDELL BORGAN
male, DERREK, SPRAGG, DERREK SPRAGG
female, ZOE, SAVIOLA, ZOE SAVIOLA
male, FREDRICK, RAMNATH, FREDRICK RAMNATH
female, KACI, SPURGER, KACI SPURGER
male, CORA, LUESCHER, CORA LUESCHER
female, ESPERANZA, RANES, ESPERANZA RANES
male, TITUS, LAPUENTE, TITUS LAPUENTE
female, JAIDEN, PALACIO, JAIDEN PALACIO
male, LONE, AKRE, LONE AKRE
female, RESSIE, JOINT, RESSIE JOINT
male, REGAN, SANKOWSKI, REGAN SANKOWSKI
female, RENADA, LEIFHEIT, RENADA LEIFHEIT
male, AMIT, PERRONI, AMIT PERRONI
female, GILLIE, DELLICARPINI, GILLIE DELLICARPINI
male, TAYLOR, NISH, TAYLOR NISH
female, SOLEDAD, SOSTAK, SOLEDAD SOSTAK
male, LINN, STROBBE, LINN STROBBE
female, LINDA, PUZIO, LINDA PUZIO
male, STEVEN, SANTAROSA, STEVEN SANTAROSA
female, TRISHA, BAELE, TRISHA BAELE
male, DEWITT, GUARDIANI, DEWITT GUARDIANI
female, VIVIANA, RAIGOSA, VIVIANA RAIGOSA
male, NIKO, LEB, NIKO LEB
female, CECILY, HALSTED, CECILY HALSTED
male, XANDER, SOMWARU, XANDER SOMWARU
female, SOPHRONIA, PRISCO, SOPHRONIA PRISCO
male, CHAS, BLASKIEWICZ, CHAS BLASKIEWICZ
female, DARIANA, DOWDALL, DARIANA DOWDALL
male, JULIEN, KRINN, JULIEN KRINN
female, DEVAN, MIHAYLOV, DEVAN MIHAYLOV
male, RACHEL, RHETT, RACHEL RHETT
female, JEANNETTE, BEHENNA, JEANNETTE BEHENNA
male, DWAIN, RAMLOW, DWAIN RAMLOW
female, KATHEY, EODICE, KATHEY EODICE
male, RACHEL, PENARAN, RACHEL PENARAN
female, DOROTHA, SAUBLE, DOROTHA SAUBLE
male, CAESAR, FLORESHERRERA, CAESAR FLORESHERRERA
female, CAMILLA, BISHKO, CAMILLA BISHKO
male, TY, KOHMAN, TY KOHMAN
female, NATALIA, PRUSS, NATALIA PRUSS
male, HARRY, SEINER, HARRY SEINER
female, CINNAMON, BOWENS, CINNAMON BOWENS
male, FISHER, FASTIGGI, FISHER FASTIGGI
female, DREMA, MORANI, DREMA MORANI
male, CODEY, WILLAFORD, CODEY WILLAFORD
female, AVIS, HANDLEY, AVIS HANDLEY
male, JAHEEM, SEABAUGH, JAHEEM SEABAUGH
female, VAL, SLUTTER, VAL SLUTTER
male, LINDY, BORNMANN, LINDY BORNMANN
female, ROBBIE, OHANESIAN, ROBBIE OHANESIAN
male, MARKUS, UNLU, MARKUS UNLU
female, JUSTINA, BECKLES, JUSTINA BECKLES
male, TERRENCE, RONNEBAUM, TERRENCE RONNEBAUM
female, ROXANA, LICKEY, ROXANA LICKEY
male, GROVE, FROUDE, GROVE FROUDE
female, ERIC, PAGUAGA, ERIC PAGUAGA
male, DANIEL, HUYNH, DANIEL HUYNH
female, IYANNA, TORREJON, IYANNA TORREJON
male, ALVIA, VANDEWEERD, ALVIA VANDEWEERD
female, LEA, BANGART, LEA BANGART
male, BARNIE, GILHOOL, BARNIE GILHOOL
female, DREW, LIBERMAN, DREW LIBERMAN
male, KELSEY, QUIVER, KELSEY QUIVER
female, LEONTINE, SANER, LEONTINE SANER
male, VERLE, FLAGLE, VERLE FLAGLE
female, DORTHA, PROVAN, DORTHA PROVAN
male, BECKETT, GROSSKLAUS, BECKETT GROSSKLAUS
female, CALLIE, BIAGIOLI, CALLIE BIAGIOLI
male, GERMAN, SCRONCE, GERMAN SCRONCE
female, ADDIE, STAES, ADDIE STAES
male, EDSEL, HOSGOOD, EDSEL HOSGOOD
female, HALLIE, JASWAL, HALLIE JASWAL
male, DONNY, HAYSLETT, DONNY HAYSLETT
female, ETHER, SEATH, ETHER SEATH
male, MARQUEZ, LINEGAR, MARQUEZ LINEGAR
female, BELVA, IGUCHI, BELVA IGUCHI
male, MILDRED, SPINOSI, MILDRED SPINOSI
female, CAROLE, SCHIMKE, CAROLE SCHIMKE
male, MOSE, APTED, MOSE APTED
female, SHERLYN, STUHMER, SHERLYN STUHMER
male, DAVIN, CORBET, DAVIN CORBET
female, JAEDA, LIBBERT, JAEDA LIBBERT
male, DOMONIQUE, KLIMAN, DOMONIQUE KLIMAN
female, BABETTE, AMITRANO, BABETTE AMITRANO
male, BROOKS, SEACHRIS, BROOKS SEACHRIS
female, LAUREEN, BURLETTE, LAUREEN BURLETTE
male, NICKOLAS, WANGELIN, NICKOLAS WANGELIN
female, CLARINDA, NEANOVER, CLARINDA NEANOVER
male, GAYLORD, GOLF, GAYLORD GOLF
female, KALLIE, COLBOURN, KALLIE COLBOURN
male, DEVEN, MINISTER, DEVEN MINISTER
female, MALISSA, DWECK, MALISSA DWECK
male, JUDGE, RUBALCAVA, JUDGE RUBALCAVA
female, ANNALISE, FEENER, ANNALISE FEENER
male, ERICH, HAUGER, ERICH HAUGER
female, ARLEY, LEROY, ARLEY LEROY
male, HORTON, DAMANIA, HORTON DAMANIA
female, JENIFER, LACERTE, JENIFER LACERTE
male, ROD, ABBUHL, ROD ABBUHL
female, BRYANNA, DEMIS, BRYANNA DEMIS
male, MYRL, DUGGER, MYRL DUGGER
female, CAITLIN, MCKERNAN, CAITLIN MCKERNAN
male, PROSPER, SCOCOZZA, PROSPER SCOCOZZA
female, ALOMA, DADDI, ALOMA DADDI
male, OZELL, CAPEN, OZELL CAPEN
female, MELISA, KLARNER, MELISA KLARNER
male, SHANNON, JAQUAY, SHANNON JAQUAY
female, MIGNON, WINNARD, MIGNON WINNARD
male, KELLEY, LENO, KELLEY LENO
female, ELEANOR, FLIESS, ELEANOR FLIESS
male, HENDERSON, BARAT, HENDERSON BARAT
female, MAKALA, KEMERER, MAKALA KEMERER
male, EVAN, REGNA, EVAN REGNA
female, GENEVA, MAGEO, GENEVA MAGEO
male, EGBERT, CERULLI, EGBERT CERULLI
female, GLENNIS, ESTES, GLENNIS ESTES
male, JEDEDIAH, TROIKE, JEDEDIAH TROIKE
female, ZARIA, MAHNKE, ZARIA MAHNKE
male, CAREY, ALTERGOTT, CAREY ALTERGOTT
female, MARGE, GALEANA, MARGE GALEANA
male, HARVY, OVERBYE, HARVY OVERBYE
female, PAMELLA, VLACH, PAMELLA VLACH
male, BRANDON, SPILMAN, BRANDON SPILMAN
female, SHARDAY, LOZAR, SHARDAY LOZAR
male, DAVID, TOMASIEWICZ, DAVID TOMASIEWICZ
female, TAWANA, FREEBAIRN, TAWANA FREEBAIRN
male, CARNELL, RIPPBERGER, CARNELL RIPPBERGER
female, SIMONA, CHONG, SIMONA CHONG
male, NEWTON, VECA, NEWTON VECA
female, TAMIKO, BAZYDLO, TAMIKO BAZYDLO
male, FRED, DANKOWSKI, FRED DANKOWSKI
female, ANNAMAE, DEMOUY, ANNAMAE DEMOUY
male, ESTER, LINKHART, ESTER LINKHART
female, JOI, FRAZEY, JOI FRAZEY
male, KEM, LAFOUNTAIN, KEM LAFOUNTAIN
female, BEYONCE, PIC, BEYONCE PIC
male, DEVIN, FREIHAUT, DEVIN FREIHAUT
female, JIMMIE, ISLAM, JIMMIE ISLAM
male, KANYE, RADEK, KANYE RADEK
female, YAMILET, BAHRI, YAMILET BAHRI
male, ELLWOOD, DONAWA, ELLWOOD DONAWA
female, BUNA, YANKER, BUNA YANKER
male, FOY, NEEDELMAN, FOY NEEDELMAN
female, CATHIE, GRENDA, CATHIE GRENDA
male, SUMNER, ZORETICH, SUMNER ZORETICH
female, RUTHANNE, BLEND, RUTHANNE BLEND
male, BRANDAN, TIPPIT, BRANDAN TIPPIT
female, ALLIE, SPACHT, ALLIE SPACHT
male, RASHAD, FRONGILLO, RASHAD FRONGILLO
female, CLEVIE, POTTERTON, CLEVIE POTTERTON
male, BUDD, FARFAN, BUDD FARFAN
female, STACY, AID, STACY AID
male, CLAY, DERNBACH, CLAY DERNBACH
female, BETHANY, AMIRAULT, BETHANY AMIRAULT
male, RHYS, STANCH, RHYS STANCH
