female, GEORGETTA, OPELT, GEORGETTA OPELT
male, CLAUDIO, MENON, CLAUDIO MENON
female, JACLYN, PANKUCH, JACLYN PANKUCH
male, SAVON, BONNING, SAVON BONNING
female, AUBREY, MILLESON, AUBREY MILLESON
male, JILES, RAVELLO, JILES RAVELLO
female, AUGUSTINA, DEVANNY, AUGUSTINA DEVANNY
male, KESHAUN, BANYARD, KESHAUN BANYARD
female, JANELL, GRADEN, JANELL GRADEN
male, DYLLAN, PULSE, DYLLAN PULSE
female, ILMA, VIANNA, ILMA VIANNA
male, LEA, MIKSA, LEA MIKSA
female, ANYA, SHEREDY, ANYA SHEREDY
male, KNUTE, SULIMAN, KNUTE SULIMAN
female, CASSONDRA, COLAHAN, CASSONDRA COLAHAN
male, DARRY, WESKE, DARRY WESKE
female, SUSIE, BACKHAUS, SUSIE BACKHAUS
male, NOEL, ELSAYED, NOEL ELSAYED
female, DAISY, NYBLOM, DAISY NYBLOM
male, EBBIE, GLEN, EBBIE GLEN
female, BRYLEE, SULCER, BRYLEE SULCER
male, LIZZIE, BANISTER, LIZZIE BANISTER
female, JESICA, HUBELE, JESICA HUBELE
male, ALVY, DISHLER, ALVY DISHLER
female, BEULA, AXON, BEULA AXON
male, LADARIUS, PHEIFER, LADARIUS PHEIFER
female, STAR, JUNDT, STAR JUNDT
male, DABNEY, PASSINAULT, DABNEY PASSINAULT
female, LOLLA, SEMAAN, LOLLA SEMAAN
male, HAYDEN, CAGWIN, HAYDEN CAGWIN
female, BRETT, DEMANGE, BRETT DEMANGE
male, WYATT, MEAD, WYATT MEAD
female, CATHERINE, MOMOH, CATHERINE MOMOH
male, HART, KINNICK, HART KINNICK
female, EDMONIA, MICARI, EDMONIA MICARI
male, LEVAR, GASPAROVICH, LEVAR GASPAROVICH
female, JAMEY, CHOWDHURY, JAMEY CHOWDHURY
male, WINSTON, NAPIERALA, WINSTON NAPIERALA
female, LESSIE, SANDAHL, LESSIE SANDAHL
male, EBERT, SANTAGATA, EBERT SANTAGATA
female, ANITRA, SANDRU, ANITRA SANDRU
male, VOLLIE, OSTRO, VOLLIE OSTRO
female, MICHELINA, GUYETT, MICHELINA GUYETT
male, MARIANO, SHAWLEY, MARIANO SHAWLEY
female, ARDYCE, BRUECKER, ARDYCE BRUECKER
male, ALMON, SPIROPOULOS, ALMON SPIROPOULOS
female, DELLAR, GNIADEK, DELLAR GNIADEK
male, JEPTHA, QUINTY, JEPTHA QUINTY
female, TRACEE, KALUA, TRACEE KALUA
male, BARTLEY, POGGENPOHL, BARTLEY POGGENPOHL
female, HEIDY, BREIDENTHAL, HEIDY BREIDENTHAL
male, TROY, MONIE, TROY MONIE
female, DANYELLE, HOFFINE, DANYELLE HOFFINE
male, MOISES, KORNMANN, MOISES KORNMANN
female, NAOMI, BIESECKER, NAOMI BIESECKER
male, WORTH, BASSITT, WORTH BASSITT
female, KIZZY, SCHOELEN, KIZZY SCHOELEN
male, WALLY, ISHAK, WALLY ISHAK
female, MARLENA, CRUMBACK, MARLENA CRUMBACK
male, MICHELE, SYLVER, MICHELE SYLVER
female, FRANCESCA, REISSMAN, FRANCESCA REISSMAN
male, SKYLAR, ALTMANN, SKYLAR ALTMANN
female, MELVINA, JIRKA, MELVINA JIRKA
male, VON, RAMIRE, VON RAMIRE
female, ROSANNE, KOLLINGER, ROSANNE KOLLINGER
male, ANTONIO, CAJINA, ANTONIO CAJINA
female, LEXUS, SRIDHAR, LEXUS SRIDHAR
male, DAN, JAMALEDDIN, DAN JAMALEDDIN
female, LEE, GAFNEY, LEE GAFNEY
male, ELIZABETH, SELVIE, ELIZABETH SELVIE
female, DARLINE, MALLAN, DARLINE MALLAN
male, FREDIE, NICHOL, FREDIE NICHOL
female, LATESHA, BODRICK, LATESHA BODRICK
male, COREY, DOURADO, COREY DOURADO
female, NALLELY, KENDLE, NALLELY KENDLE
male, BLANCHARD, ZUPA, BLANCHARD ZUPA
female, FANNYE, BUESCHEL, FANNYE BUESCHEL
male, MACARTHUR, TURCHIANO, MACARTHUR TURCHIANO
female, AMINA, ZABACK, AMINA ZABACK
male, GERARD, GIARAMITA, GERARD GIARAMITA
female, AMYA, PRENDIVILLE, AMYA PRENDIVILLE
male, QUENTIN, PIRA, QUENTIN PIRA
female, TONIA, KILPACK, TONIA KILPACK
male, ROMA, PSIMER, ROMA PSIMER
female, THURSA, WEDMORE, THURSA WEDMORE
male, ZECHARIAH, ARNASON, ZECHARIAH ARNASON
female, MALLIE, SINEGAL, MALLIE SINEGAL
male, REGINAL, MEETZE, REGINAL MEETZE
female, SUNNY, SEMENIUK, SUNNY SEMENIUK
male, CROCKETT, ISHIMARU, CROCKETT ISHIMARU
female, KARI, LANSINK, KARI LANSINK
male, WARREN, NIERENHAUSEN, WARREN NIERENHAUSEN
female, VERNICE, GUHDE, VERNICE GUHDE
male, VERLON, BAUZA, VERLON BAUZA
female, JUANA, STACK, JUANA STACK
male, JULIEN, HOPPE, JULIEN HOPPE
female, GERMAINE, ZAHARKO, GERMAINE ZAHARKO
male, CLAYTON, STEAGALL, CLAYTON STEAGALL
female, ALEENA, DENVIR, ALEENA DENVIR
male, BRENDAN, REES, BRENDAN REES
female, VIRGINIA, LIU, VIRGINIA LIU
male, JACKSON, WYNSTRA, JACKSON WYNSTRA
female, CAPPIE, HILGENBERG, CAPPIE HILGENBERG
male, AIDYN, IANNETTI, AIDYN IANNETTI
female, NINNIE, HATTENDORF, NINNIE HATTENDORF
male, KEVON, PISTELLA, KEVON PISTELLA
female, SYDNIE, TAU, SYDNIE TAU
male, ISAM, OKE, ISAM OKE
female, LESTA, PANICKER, LESTA PANICKER
male, ODA, MACIOLEK, ODA MACIOLEK
female, CANDICE, BARLAGE, CANDICE BARLAGE
male, SINCERE, GOOL, SINCERE GOOL
female, ESSA, DECLAY, ESSA DECLAY
male, KAMRYN, IGARTA, KAMRYN IGARTA
female, CECELIA, DAX, CECELIA DAX
male, GENNARO, PENSKI, GENNARO PENSKI
female, SERENITY, GATESMAN, SERENITY GATESMAN
male, VINCENZO, BERTOTTI, VINCENZO BERTOTTI
female, FLORENE, LENIK, FLORENE LENIK
male, TORRY, VOLPICELLI, TORRY VOLPICELLI
female, MAUD, HOT, MAUD HOT
male, AUGUSTIN, GRINER, AUGUSTIN GRINER
female, IONE, KRECK, IONE KRECK
male, DERRICK, SWAFFER, DERRICK SWAFFER
female, NANCY, GIBBS, NANCY GIBBS
male, GILES, BALLI, GILES BALLI
female, NIKKI, BIERCE, NIKKI BIERCE
male, KEYON, FORESTIER, KEYON FORESTIER
female, KIMBER, NANK, KIMBER NANK
male, RODDY, MCFIELD, RODDY MCFIELD
female, PENNIE, TARE, PENNIE TARE
male, SKYLAR, DAMBROSE, SKYLAR DAMBROSE
female, ROXANNE, BERKOFF, ROXANNE BERKOFF
male, DAVON, PELUSO, DAVON PELUSO
female, CARINA, GOU, CARINA GOU
male, RYLAND, THOME, RYLAND THOME
female, GEORGETTA, SHEDDAN, GEORGETTA SHEDDAN
male, WINFIELD, TONRY, WINFIELD TONRY
female, CHRISTAL, KOMMAREDDY, CHRISTAL KOMMAREDDY
male, TOSHIO, GIOMI, TOSHIO GIOMI
female, SKYLER, HAWKSWORTH, SKYLER HAWKSWORTH
male, PALMER, RADDER, PALMER RADDER
female, JERRILYN, WITALIS, JERRILYN WITALIS
male, KONNER, NOAKES, KONNER NOAKES
female, ASHA, POLACEK, ASHA POLACEK
male, DORA, TODE, DORA TODE
female, NAYELY, PLOTZKE, NAYELY PLOTZKE
male, TAJ, REIFER, TAJ REIFER
female, LU, SHATTLES, LU SHATTLES
male, LEM, BURT, LEM BURT
female, LULIE, AMATON, LULIE AMATON
male, AUGUSTIN, CLOUGHERTY, AUGUSTIN CLOUGHERTY
female, BUELAH, MCVEIGH, BUELAH MCVEIGH
male, NICHOLAUS, LORTZ, NICHOLAUS LORTZ
female, CORALIE, RYGALSKI, CORALIE RYGALSKI
male, UNKNOWN, CHOQUET, UNKNOWN CHOQUET
female, LILIE, DISHONGH, LILIE DISHONGH
male, RICH, PRUITTE, RICH PRUITTE
female, PAITYN, MANROSS, PAITYN MANROSS
male, KURTIS, DOORN, KURTIS DOORN
female, EMERY, RZEPA, EMERY RZEPA
male, PERNELL, CAMPEAU, PERNELL CAMPEAU
female, SIBYL, POTTORF, SIBYL POTTORF
male, VICTOR, KORBAS, VICTOR KORBAS
female, CITLALI, MITOLA, CITLALI MITOLA
male, DORMAN, DURRUM, DORMAN DURRUM
female, ALISA, OCHIENG, ALISA OCHIENG
male, CHARLIE, LUTCHER, CHARLIE LUTCHER
female, ODIE, KOUGHER, ODIE KOUGHER
male, HOBART, BRAGE, HOBART BRAGE
female, EMALINE, OSE, EMALINE OSE
male, EARL, NGOM, EARL NGOM
female, ELZIE, ZACCAGNINO, ELZIE ZACCAGNINO
male, SHAWN, BIJEAUX, SHAWN BIJEAUX
female, KAYDEN, RUMER, KAYDEN RUMER
male, CAESAR, BURANEN, CAESAR BURANEN
female, CHARLIZE, CULLIP, CHARLIZE CULLIP
male, JOVANY, RUBASH, JOVANY RUBASH
female, SUZANNE, ESTRADAPEREZ, SUZANNE ESTRADAPEREZ
male, JEP, KARIM, JEP KARIM
female, ABIGAYLE, YOKOMIZO, ABIGAYLE YOKOMIZO
male, HJALMER, GARZARO, HJALMER GARZARO
female, SHALON, PALACE, SHALON PALACE
male, CHANCY, MOKU, CHANCY MOKU
female, GUSTA, NAPIERALSKI, GUSTA NAPIERALSKI
male, CYRIL, RIDHA, CYRIL RIDHA
female, ELVA, POPOOLA, ELVA POPOOLA
male, ELZIE, PETRISKO, ELZIE PETRISKO
female, EDEN, WETSCH, EDEN WETSCH
male, HARLAND, RANCATORE, HARLAND RANCATORE
female, JAYME, TRETTEL, JAYME TRETTEL
male, TORRENCE, BHAYANI, TORRENCE BHAYANI
female, EVE, KINCADE, EVE KINCADE
male, EDMUND, FARNELL, EDMUND FARNELL
female, RHIANNA, KOSTA, RHIANNA KOSTA
male, SUMNER, LEITL, SUMNER LEITL
female, ELOUISE, PECUNIA, ELOUISE PECUNIA
male, WELLINGTON, VANDERPOEL, WELLINGTON VANDERPOEL
female, BEAULAH, STROMMEN, BEAULAH STROMMEN
male, LYDELL, DATE, LYDELL DATE
female, LORIA, HERTZKE, LORIA HERTZKE
male, ZACHARIAH, FRYMIER, ZACHARIAH FRYMIER
female, KIMBERLIE, ARRIGHI, KIMBERLIE ARRIGHI
male, GARNER, ARRON, GARNER ARRON
female, ALEXIA, HENDRIX, ALEXIA HENDRIX
male, STORM, URWILLER, STORM URWILLER
female, KRISSY, VEERAPPAN, KRISSY VEERAPPAN
male, ELIJAH, ERICSSON, ELIJAH ERICSSON
female, DOLLIE, EDLER, DOLLIE EDLER
male, OTIS, MARTER, OTIS MARTER
female, CHRISTIAN, AMSHOFF, CHRISTIAN AMSHOFF
male, RAYNARD, PICHE, RAYNARD PICHE
female, STACEY, FORMOSO, STACEY FORMOSO
male, DEVAN, SCHWEPPE, DEVAN SCHWEPPE
female, CHERYLL, MITTENDORF, CHERYLL MITTENDORF
male, BRENT, BARTMESS, BRENT BARTMESS
female, NARCISSUS, MARCHUT, NARCISSUS MARCHUT
male, LUTHER, ELLEFSON, LUTHER ELLEFSON
female, ERIS, NEGREROS, ERIS NEGREROS
male, GANNON, RABER, GANNON RABER
female, ARLEY, DEAMICIS, ARLEY DEAMICIS
male, MOISES, SAECHIN, MOISES SAECHIN
female, ELISABETH, DODDA, ELISABETH DODDA
male, JARETT, MCCONAUGHEY, JARETT MCCONAUGHEY
female, KIMBERELY, AHNEE, KIMBERELY AHNEE
male, TRUMAINE, KINS, TRUMAINE KINS
female, FLORENE, WILTGEN, FLORENE WILTGEN
male, HERSHEL, GIESKEN, HERSHEL GIESKEN
female, ALLYSSA, DELLAGATTA, ALLYSSA DELLAGATTA
male, HORATIO, ROSONE, HORATIO ROSONE
female, LILIANA, HAMLER, LILIANA HAMLER
male, BURNS, LHUILLIER, BURNS LHUILLIER
female, KAITLYN, RUTKA, KAITLYN RUTKA
male, JUDITH, SERRAINO, JUDITH SERRAINO
female, ARIZONA, BELLMORE, ARIZONA BELLMORE
male, KELVIN, RORIE, KELVIN RORIE
female, KAREN, SICAN, KAREN SICAN
male, ELWYN, FENICK, ELWYN FENICK
female, MAKALA, TEACHWORTH, MAKALA TEACHWORTH
male, LISLE, DISTELRATH, LISLE DISTELRATH
female, CLAUDE, SINGMASTER, CLAUDE SINGMASTER
male, MALVIN, TUSI, MALVIN TUSI
female, ANJANETTE, BENIGHT, ANJANETTE BENIGHT
male, SHOJI, PLOOR, SHOJI PLOOR
female, CELIE, TATRO, CELIE TATRO
male, KYREE, TUANG, KYREE TUANG
female, BREE, BEDIENT, BREE BEDIENT
male, EDEN, CRISWELL, EDEN CRISWELL
female, VETA, DEASEY, VETA DEASEY
male, DOMINQUE, BASNER, DOMINQUE BASNER
female, KESHA, MAZZOCCO, KESHA MAZZOCCO
male, JERALD, MOGEL, JERALD MOGEL
female, PEGGY, ISGETT, PEGGY ISGETT
male, EBEN, LAMANSKY, EBEN LAMANSKY
female, STARR, ZECUA, STARR ZECUA
male, BERTIE, DEIGHAN, BERTIE DEIGHAN
female, SELINA, OLSZOWKA, SELINA OLSZOWKA
male, HENDERSON, BUCKINS, HENDERSON BUCKINS
female, EDDIE, VANDERPOEL, EDDIE VANDERPOEL
male, BRAEDON, BROYARD, BRAEDON BROYARD
female, PEARLY, ORVIS, PEARLY ORVIS
male, KALEN, HINDEL, KALEN HINDEL
female, GRAYCE, BRZYSKI, GRAYCE BRZYSKI
male, MITCHEL, MANTHE, MITCHEL MANTHE
female, ETNA, DEMUYNCK, ETNA DEMUYNCK
male, ARNIE, CAPALBO, ARNIE CAPALBO
female, CORIE, GOSLIN, CORIE GOSLIN
male, RAPHAEL, AKI, RAPHAEL AKI
female, MELODEE, THURIN, MELODEE THURIN
male, AMIL, JAGEMAN, AMIL JAGEMAN
female, ORPHA, CHENNAULT, ORPHA CHENNAULT
male, CHAD, WAKELAND, CHAD WAKELAND
female, EMILIE, BIRNIE, EMILIE BIRNIE
male, THEOPHILE, STROUTH, THEOPHILE STROUTH
female, DAISYE, ZWANZIG, DAISYE ZWANZIG
male, DEVAUGHN, MACADANGDANG, DEVAUGHN MACADANGDANG
female, EOLA, EADDY, EOLA EADDY
male, DEREK, SKUCE, DEREK SKUCE
female, AUBREE, HOTLE, AUBREE HOTLE
male, LILLIAN, QUANEY, LILLIAN QUANEY
female, VIKKI, ALSHAIF, VIKKI ALSHAIF
male, EASTON, TREVISO, EASTON TREVISO
female, CELESTE, NEUTZLING, CELESTE NEUTZLING
male, ALEXANDE, MIRAGLIOTTA, ALEXANDE MIRAGLIOTTA
female, TAMMI, ALMONTE, TAMMI ALMONTE
male, ARLIN, MORRELL, ARLIN MORRELL
female, DEZZIE, MAYNE, DEZZIE MAYNE
male, TAUREAN, MANGROO, TAUREAN MANGROO
female, ALVERA, CHIAN, ALVERA CHIAN
male, TERRILL, REDINGTON, TERRILL REDINGTON
female, SADE, ASHMEN, SADE ASHMEN
male, RHETT, CASTRILLON, RHETT CASTRILLON
female, VARA, MARGIOTTA, VARA MARGIOTTA
male, DOLORES, RABIZADEH, DOLORES RABIZADEH
female, NELLY, CHAUSSE, NELLY CHAUSSE
male, ALAN, TAROLI, ALAN TAROLI
female, TEAGAN, MILETELLO, TEAGAN MILETELLO
male, COOPER, HALDIMAN, COOPER HALDIMAN
female, ILENE, BRADACH, ILENE BRADACH
male, PIERRE, GALIT, PIERRE GALIT
female, HENRIETTA, TECHERA, HENRIETTA TECHERA
male, ALMER, KLARMANN, ALMER KLARMANN
female, JIMENA, BAACK, JIMENA BAACK
male, FISHER, DIEPPA, FISHER DIEPPA
female, MARGENE, SUNDT, MARGENE SUNDT
male, GAETANO, PORTTEUS, GAETANO PORTTEUS
female, NICKI, KUBER, NICKI KUBER
male, WILFRED, CUNDY, WILFRED CUNDY
female, VALERIE, BUFFO, VALERIE BUFFO
male, HOUSTON, CEKADA, HOUSTON CEKADA
female, DOVIE, MOLSKI, DOVIE MOLSKI
male, ENOS, CISNEROS, ENOS CISNEROS
female, PORTIA, MINGLEDORFF, PORTIA MINGLEDORFF
male, JOE, POSTEK, JOE POSTEK
female, CONSUELO, KESSEL, CONSUELO KESSEL
male, ZAYDEN, DELCRUZ, ZAYDEN DELCRUZ
female, RHEA, TANGEN, RHEA TANGEN
male, LLEWELLYN, BAILY, LLEWELLYN BAILY
female, NICHOL, DUTSCHKE, NICHOL DUTSCHKE
male, JANET, SHERRITT, JANET SHERRITT
female, MADGE, SITARAS, MADGE SITARAS
male, ANTWON, COGMAN, ANTWON COGMAN
female, EITHEL, LAYSER, EITHEL LAYSER
male, KASON, SCHEUREN, KASON SCHEUREN
female, BEAULAH, TINDALE, BEAULAH TINDALE
male, LEMON, AYALAGONZALEZ, LEMON AYALAGONZALEZ
female, VIRGINIA, CONIGLIARO, VIRGINIA CONIGLIARO
male, AMARION, CHATTERTON, AMARION CHATTERTON
female, GABRIEL, BANNER, GABRIEL BANNER
male, ARI, PLAYFORD, ARI PLAYFORD
female, MARGRETTA, GENSAMER, MARGRETTA GENSAMER
male, SIDNEY, VIAU, SIDNEY VIAU
female, JEFFREY, NAPE, JEFFREY NAPE
male, CASSIE, RUBSAM, CASSIE RUBSAM
female, MIKAILA, VANLUCHENE, MIKAILA VANLUCHENE
male, MARCOS, THOMASBROWN, MARCOS THOMASBROWN
female, MADIE, CARMENATTY, MADIE CARMENATTY
male, WILFREDO, VRBKA, WILFREDO VRBKA
female, FAYE, MACNICHOL, FAYE MACNICHOL
male, CARMELO, SCHWAN, CARMELO SCHWAN
female, NATALIA, CARMIEN, NATALIA CARMIEN
male, ISMAEL, SHEFFIELD, ISMAEL SHEFFIELD
female, CLETA, HUTNER, CLETA HUTNER
male, KEYSHAWN, GOODHAND, KEYSHAWN GOODHAND
female, LATOSHA, FINEBERG, LATOSHA FINEBERG
male, REX, BADOUR, REX BADOUR
female, ZELLA, LEALE, ZELLA LEALE
male, ISIDRO, CRYMES, ISIDRO CRYMES
female, CELIA, DISSINGER, CELIA DISSINGER
male, DURRELL, TOMCO, DURRELL TOMCO
female, ZONA, NICHO, ZONA NICHO
male, RAYBURN, BELSHAW, RAYBURN BELSHAW
female, ALLYSSA, MOTTINGER, ALLYSSA MOTTINGER
male, ALWIN, KAK, ALWIN KAK
female, BROOKLYN, MANZKE, BROOKLYN MANZKE
male, DESHAUN, TA, DESHAUN TA
female, ZAIDA, BIDDISCOMBE, ZAIDA BIDDISCOMBE
male, DEFOREST, RAME, DEFOREST RAME
female, GREGORIA, KIDANE, GREGORIA KIDANE
male, RANDY, LUDGATE, RANDY LUDGATE
female, LATRICIA, BRAZINGTON, LATRICIA BRAZINGTON
male, BRENDA, BURA, BRENDA BURA
female, ANDREA, TILLIE, ANDREA TILLIE
male, DIALLO, FENNEWALD, DIALLO FENNEWALD
female, ASHLYN, LUKOWIAK, ASHLYN LUKOWIAK
male, ALFIE, MIGNACCA, ALFIE MIGNACCA
female, ARETHA, NIBLER, ARETHA NIBLER
male, HALL, AURICH, HALL AURICH
female, ROSALINE, PLEINIS, ROSALINE PLEINIS
male, LUCIUS, GRAVERAN, LUCIUS GRAVERAN
female, CHIMERE, NITO, CHIMERE NITO
male, AMMON, RUTKOWSKY, AMMON RUTKOWSKY
female, ERLINE, WOERTH, ERLINE WOERTH
male, HERBERT, MCHAM, HERBERT MCHAM
female, CINDI, PARADA, CINDI PARADA
male, KOREY, MCKAUGHAN, KOREY MCKAUGHAN
female, LATASHA, KALLAUS, LATASHA KALLAUS
male, CLELL, POTHOFF, CLELL POTHOFF
female, LOUISIANA, TARAS, LOUISIANA TARAS
male, RYAN, HURRELL, RYAN HURRELL
female, LUDIE, BAZNER, LUDIE BAZNER
male, DALE, WISHERT, DALE WISHERT
female, DIAN, JESPERSEN, DIAN JESPERSEN
male, PRINCE, OBAKER, PRINCE OBAKER
female, FAWN, ECHENIQUE, FAWN ECHENIQUE
male, TALAN, MIRONYUK, TALAN MIRONYUK
female, LAVONIA, SCAMMELL, LAVONIA SCAMMELL
male, GRAYSON, BUGAJSKI, GRAYSON BUGAJSKI
female, HUNTER, GANTNER, HUNTER GANTNER
male, THURMAN, BLUEDORN, THURMAN BLUEDORN
female, JETTA, CARRINGTON, JETTA CARRINGTON
male, EVA, TLATELPA, EVA TLATELPA
female, JOSLYN, LOUTHAN, JOSLYN LOUTHAN
male, RODNEY, NESTLEROAD, RODNEY NESTLEROAD
female, SUSANNA, MELOTTE, SUSANNA MELOTTE
male, OTHO, KHELA, OTHO KHELA
female, AURORE, BRUMLOW, AURORE BRUMLOW
male, FERDINAND, CAMBAS, FERDINAND CAMBAS
female, VENESSA, SCHAECHER, VENESSA SCHAECHER
male, WYATT, MCCRIMMON, WYATT MCCRIMMON
female, LUETTA, DONSBACH, LUETTA DONSBACH
male, EZRA, GALLUPPI, EZRA GALLUPPI
female, MONTANA, REPPEL, MONTANA REPPEL
male, ROMELLO, PAPPION, ROMELLO PAPPION
female, EULAH, KEEM, EULAH KEEM
male, MARTELL, MARTONE, MARTELL MARTONE
female, KARISSA, MANSUR, KARISSA MANSUR
male, DARRYLL, NEITZ, DARRYLL NEITZ
female, FRIEDA, HODSDON, FRIEDA HODSDON
male, GILES, BORON, GILES BORON
female, STASIA, BADGLEY, STASIA BADGLEY
male, ELIHU, ARGUELLEZ, ELIHU ARGUELLEZ
female, JOCELYN, STROBACH, JOCELYN STROBACH
male, ARDELL, DAVULURI, ARDELL DAVULURI
female, CRISTEN, AUGUSTINO, CRISTEN AUGUSTINO
male, COLUMBUS, BIRKELBACH, COLUMBUS BIRKELBACH
female, MADISYN, MELARAGNO, MADISYN MELARAGNO
male, AUGUSTE, MINTS, AUGUSTE MINTS
female, KAZUKO, AHLES, KAZUKO AHLES
male, HENCE, LEYLAND, HENCE LEYLAND
female, SYDELL, CEDRES, SYDELL CEDRES
male, DARRIN, BOURDO, DARRIN BOURDO
female, MAI, PYM, MAI PYM
male, CYRUS, BATTREALL, CYRUS BATTREALL
female, LUTIE, VANORD, LUTIE VANORD
male, JEFFERY, BRANTS, JEFFERY BRANTS
female, NORMAN, CRESCENTE, NORMAN CRESCENTE
male, SIMON, OGILBEE, SIMON OGILBEE
female, PAIRLEE, REAGANS, PAIRLEE REAGANS
male, ROLANDO, SCHLEPPI, ROLANDO SCHLEPPI
female, AUDRIANNA, JANCA, AUDRIANNA JANCA
male, BRANDAN, STALLSWORTH, BRANDAN STALLSWORTH
female, MALINDA, HERSHMAN, MALINDA HERSHMAN
male, LAFE, SERRALTA, LAFE SERRALTA
female, QIANA, GREGSTON, QIANA GREGSTON
male, HILBERT, NOVINGER, HILBERT NOVINGER
female, SHIELA, DUPRAY, SHIELA DUPRAY
male, SAMSON, CHLEBECK, SAMSON CHLEBECK
female, THEOLA, SHIVAK, THEOLA SHIVAK
male, CHANCY, TZIC, CHANCY TZIC
female, NONA, DUENAZ, NONA DUENAZ
male, BRENTON, ELSBECKER, BRENTON ELSBECKER
female, ERLINDA, HENAO, ERLINDA HENAO
male, GERRY, PANFIL, GERRY PANFIL
female, KATHERIN, NEWMYER, KATHERIN NEWMYER
male, ELONZO, BOSSHARDT, ELONZO BOSSHARDT
female, ADELINE, GIRDLEY, ADELINE GIRDLEY
male, LEONARDO, KERSCHNER, LEONARDO KERSCHNER
female, OSA, KEEBLER, OSA KEEBLER
male, SHAFTER, BARRALAGA, SHAFTER BARRALAGA
female, LUTIE, NARASIMHAN, LUTIE NARASIMHAN
male, AMIR, ABRUZZO, AMIR ABRUZZO
female, ALYSSA, KAPPERT, ALYSSA KAPPERT
male, SOLOMAN, FARAJI, SOLOMAN FARAJI
female, LATONYA, SWEARNGIN, LATONYA SWEARNGIN
male, GAVYN, SCHRADE, GAVYN SCHRADE
female, LOLLIE, LENNARD, LOLLIE LENNARD
male, ANDON, LUGTU, ANDON LUGTU
female, PEARLE, ARONI, PEARLE ARONI
male, MOHAMED, METZMEIER, MOHAMED METZMEIER
female, LAILAH, GARRON, LAILAH GARRON
male, JASPER, SESTA, JASPER SESTA
female, INGRID, KEYLOR, INGRID KEYLOR
male, BRENDA, HELGEMO, BRENDA HELGEMO
female, DAYNA, PLETTNER, DAYNA PLETTNER
male, HANSEL, FLITCROFT, HANSEL FLITCROFT
female, KENDALL, KOONZ, KENDALL KOONZ
male, SIE, TRIFONOV, SIE TRIFONOV
female, RITA, MANUEL, RITA MANUEL
male, HANS, GILLPATRICK, HANS GILLPATRICK
female, KALEIGH, BOWAN, KALEIGH BOWAN
male, OTT, SCHEPKER, OTT SCHEPKER
female, PALOMA, KISSINGER, PALOMA KISSINGER
male, RICKEY, SAGLIMBENI, RICKEY SAGLIMBENI
female, PALOMA, BALLATO, PALOMA BALLATO
male, KHIRY, TOLEAFOA, KHIRY TOLEAFOA
female, FRANCIES, DRESS, FRANCIES DRESS
male, DEFOREST, WINGSTER, DEFOREST WINGSTER
female, CLARE, HAILE, CLARE HAILE
male, LOUISE, IYER, LOUISE IYER
female, ODIE, MAGARO, ODIE MAGARO
male, FED, GARDINA, FED GARDINA
female, MAGDALENE, OSHA, MAGDALENE OSHA
male, ERASTUS, HANNS, ERASTUS HANNS
female, LOUVENIA, TEHANDON, LOUVENIA TEHANDON
male, RASHEED, SELVAGE, RASHEED SELVAGE
female, MALISSA, SACKO, MALISSA SACKO
male, RONIN, PUNTIEL, RONIN PUNTIEL
female, STEPHANI, SEMANCHIK, STEPHANI SEMANCHIK
male, ORIS, SEINER, ORIS SEINER
female, MAME, HOLETS, MAME HOLETS
male, MARGARET, PALLEN, MARGARET PALLEN
female, SIGNE, MCCUSKER, SIGNE MCCUSKER
male, KEON, HAGGAS, KEON HAGGAS
female, VERNIA, KOBBE, VERNIA KOBBE
male, VON, DIMMERLING, VON DIMMERLING
female, IVIE, JARDIM, IVIE JARDIM
male, ESSEX, VANBOREN, ESSEX VANBOREN
female, SHERYL, SPRUNG, SHERYL SPRUNG
male, DEBORAH, DEMARCO, DEBORAH DEMARCO
female, BONITA, BILLONE, BONITA BILLONE
male, HAMPTON, MONTANUS, HAMPTON MONTANUS
female, ORMA, VANDALSEM, ORMA VANDALSEM
male, CASSIUS, FRIEDT, CASSIUS FRIEDT
female, VERNE, SELVA, VERNE SELVA
male, ALFIE, CROMP, ALFIE CROMP
female, LYDA, SAGLIMBENI, LYDA SAGLIMBENI
male, CARTER, HAMSHER, CARTER HAMSHER
female, KATTIE, REYESPEREZ, KATTIE REYESPEREZ
male, OLAN, ETTORRE, OLAN ETTORRE
female, SAGE, CALIBOSO, SAGE CALIBOSO
male, DARRION, GANIC, DARRION GANIC
female, ALEXANDRA, KUJAK, ALEXANDRA KUJAK
male, CAYDEN, RICHELIEU, CAYDEN RICHELIEU
female, MISTIE, QUINN, MISTIE QUINN
male, HARVE, DOINO, HARVE DOINO
female, ASHLY, KOESSEL, ASHLY KOESSEL
male, PIERCE, HERNANDEZLEON, PIERCE HERNANDEZLEON
female, TAMMIE, GEDA, TAMMIE GEDA
male, BENARD, SCHUK, BENARD SCHUK
female, DIXIE, ESHO, DIXIE ESHO
male, WARREN, MUTHUSWAMY, WARREN MUTHUSWAMY
female, ENOLA, BUCCINI, ENOLA BUCCINI
male, WILFORD, SEVERIANO, WILFORD SEVERIANO
female, ETHYLE, TENEMAZA, ETHYLE TENEMAZA
male, BRANNON, BELKEN, BRANNON BELKEN
female, EDWARD, BULINGTON, EDWARD BULINGTON
male, GLOVER, TOLLNER, GLOVER TOLLNER
female, IVONNE, AGRE, IVONNE AGRE
male, DAVANTE, MAQUEIRA, DAVANTE MAQUEIRA
female, LEANNA, JURISICH, LEANNA JURISICH
male, ADDISON, GRAUSE, ADDISON GRAUSE
female, SHELBI, JOULE, SHELBI JOULE
male, ESTILL, MONTERO, ESTILL MONTERO
female, KYLA, RIVELLO, KYLA RIVELLO
male, ARVEL, JACQUART, ARVEL JACQUART
female, CLIFFIE, GUERREIRO, CLIFFIE GUERREIRO
male, HASSAN, TAPPER, HASSAN TAPPER
female, GRETA, MOWRER, GRETA MOWRER
male, SONNY, CARDOZA, SONNY CARDOZA
female, STEVEN, FLEMENS, STEVEN FLEMENS
male, CLAUDIE, ELLINGWOOD, CLAUDIE ELLINGWOOD
female, MARCELINA, PLETCHER, MARCELINA PLETCHER
male, BABYBOY, BURSHIA, BABYBOY BURSHIA
female, ELISSA, OASE, ELISSA OASE
male, JERED, MAICHEL, JERED MAICHEL
female, ILDA, ALIG, ILDA ALIG
male, JEREMY, KOWN, JEREMY KOWN
female, CHRISTEEN, WALSHAK, CHRISTEEN WALSHAK
male, HOLLIS, ELLICKSON, HOLLIS ELLICKSON
female, JALYNN, DITTY, JALYNN DITTY
male, OCTAVIUS, FOGWELL, OCTAVIUS FOGWELL
female, SHENNA, PIUNNO, SHENNA PIUNNO
male, TARIQ, TREBINO, TARIQ TREBINO
female, KATI, PICCIURRO, KATI PICCIURRO
male, CONNER, KIRCHHEVEL, CONNER KIRCHHEVEL
female, KASSANDRA, LAMORIE, KASSANDRA LAMORIE
male, ENRICO, OBLIGACION, ENRICO OBLIGACION
female, TINIE, VILLAPANDO, TINIE VILLAPANDO
male, LONNY, HAUSSMANN, LONNY HAUSSMANN
female, MANNIE, ARZT, MANNIE ARZT
male, GAGE, LEIFERT, GAGE LEIFERT
female, DAISIE, BENCA, DAISIE BENCA
male, COLLIN, CARLUCCI, COLLIN CARLUCCI
female, NOMA, MCSHANNON, NOMA MCSHANNON
male, MAXIM, LEONESIO, MAXIM LEONESIO
female, STELLA, JARRELS, STELLA JARRELS
male, RAY, BROCKSCHMIDT, RAY BROCKSCHMIDT
female, CLEMENTINA, SAINTILUS, CLEMENTINA SAINTILUS
male, CHIP, TOMIC, CHIP TOMIC
female, TRESA, SISKA, TRESA SISKA
male, GRANVILLE, URMSTON, GRANVILLE URMSTON
female, MARLYN, LOETHER, MARLYN LOETHER
male, ANGUS, REVELEY, ANGUS REVELEY
female, HUNTER, LATORRACA, HUNTER LATORRACA
male, OCIE, PACKEBUSH, OCIE PACKEBUSH
female, GERTHA, MENICUCCI, GERTHA MENICUCCI
male, BIRD, KOWALEWSKI, BIRD KOWALEWSKI
female, BRITTNY, PILLIS, BRITTNY PILLIS
male, LEWIS, GILLOCK, LEWIS GILLOCK
female, CHANTAL, PATRAS, CHANTAL PATRAS
male, REGIS, OPRE, REGIS OPRE
female, GERMAINE, VOROUS, GERMAINE VOROUS
male, LOVIE, AUTOBEE, LOVIE AUTOBEE
female, HALIE, LIMAURO, HALIE LIMAURO
male, JUWAN, MCAROY, JUWAN MCAROY
female, HEIDI, SOWERS, HEIDI SOWERS
male, ZEB, CIKO, ZEB CIKO
female, NYLAH, SCHLEIGH, NYLAH SCHLEIGH
male, JONNIE, BOSTEDO, JONNIE BOSTEDO
female, TIFFANI, LUSTENBERGER, TIFFANI LUSTENBERGER
male, STACEY, SANCHEZCASTILL, STACEY SANCHEZCASTILL
female, JESENIA, VESA, JESENIA VESA
male, DAMIAN, SCERCY, DAMIAN SCERCY
female, PORSCHE, THINNES, PORSCHE THINNES
male, VIRGE, SENFFNER, VIRGE SENFFNER
female, ADRIENE, ABBENANTE, ADRIENE ABBENANTE
male, GRAHAM, HURM, GRAHAM HURM
female, VERNIA, MOGHIMI, VERNIA MOGHIMI
male, EDSEL, SILAR, EDSEL SILAR
female, ABBIE, SAIR, ABBIE SAIR
male, MACKENZIE, ORTIZMORALES, MACKENZIE ORTIZMORALES
female, MILLICENT, HAFFEY, MILLICENT HAFFEY
male, ALFORD, KRETSCHMANN, ALFORD KRETSCHMANN
female, TOSHIKO, ITO, TOSHIKO ITO
male, WILEY, SZOSTEK, WILEY SZOSTEK
female, KIMORA, WAIN, KIMORA WAIN
male, TRAVIS, SALEWSKY, TRAVIS SALEWSKY
female, YADIRA, PSAROS, YADIRA PSAROS
male, CLEVELAND, CAMINOS, CLEVELAND CAMINOS
female, WILLENE, LEICHTLE, WILLENE LEICHTLE
male, KESHAUN, SIMPAO, KESHAUN SIMPAO
female, JUSTINE, MORESI, JUSTINE MORESI
male, STONE, BECKSTEAD, STONE BECKSTEAD
female, LURA, NATHER, LURA NATHER
male, TOREY, KENNISON, TOREY KENNISON
female, GIRTHA, CHINNOCK, GIRTHA CHINNOCK
male, HARLEY, PROCE, HARLEY PROCE
female, ROCIO, SAI, ROCIO SAI
male, RONAN, RONNOW, RONAN RONNOW
female, RENA, WALKENBACH, RENA WALKENBACH
male, LOVETT, BOLF, LOVETT BOLF
female, JASLYN, ARJUN, JASLYN ARJUN
male, RORY, RIGGAR, RORY RIGGAR
female, FRANCIS, LUCHTEFELD, FRANCIS LUCHTEFELD
male, DARRELL, LEIVA, DARRELL LEIVA
female, MIA, ALVARE, MIA ALVARE
male, NORMAN, KILKENNY, NORMAN KILKENNY
female, HANNA, STOLZE, HANNA STOLZE
male, CAEL, STEENBURG, CAEL STEENBURG
female, FREIDA, MCVAY, FREIDA MCVAY
male, CHALMERS, PANSING, CHALMERS PANSING
female, LAVERN, INCHES, LAVERN INCHES
male, JAQUAN, MASERANG, JAQUAN MASERANG
female, EARLENE, COLMENAREZ, EARLENE COLMENAREZ
male, HERSHELL, TAUSCH, HERSHELL TAUSCH
female, LAILAH, CAVERA, LAILAH CAVERA
male, TATSUO, HAIDLE, TATSUO HAIDLE
female, PARIS, RISTAU, PARIS RISTAU
male, KAYE, RIELAND, KAYE RIELAND
female, JAYCEE, SOUVANNASANE, JAYCEE SOUVANNASANE
male, ELIZA, ESPINAL, ELIZA ESPINAL
female, MONIKA, WILBORN, MONIKA WILBORN
male, CYNTHIA, EVITTS, CYNTHIA EVITTS
female, BEYONCE, CANELL, BEYONCE CANELL
male, ORION, CORDONNIER, ORION CORDONNIER
female, HAYLEY, MIKA, HAYLEY MIKA
male, WHIT, ANGELOTTI, WHIT ANGELOTTI
female, LORELAI, PICHEY, LORELAI PICHEY
male, DOMENIC, VIGER, DOMENIC VIGER
female, LILAH, WAECHTLER, LILAH WAECHTLER
male, DARRYLL, ABBINANTI, DARRYLL ABBINANTI
female, KIMORA, HIPPLE, KIMORA HIPPLE
male, TYREK, HULLEY, TYREK HULLEY
female, DEMA, BLINKA, DEMA BLINKA
male, DERIK, MASTRONARDO, DERIK MASTRONARDO
female, BONNY, PHAROAH, BONNY PHAROAH
male, BENJAMAN, ADAMIEC, BENJAMAN ADAMIEC
female, ZOIE, DRASKOVICH, ZOIE DRASKOVICH
male, MERVYN, AUGILAR, MERVYN AUGILAR
female, VILLA, FERIDO, VILLA FERIDO
male, FRANKLIN, NOAH, FRANKLIN NOAH
female, MARIN, ALATTAR, MARIN ALATTAR
male, MALACHI, FISLER, MALACHI FISLER
female, LARAE, BORELLA, LARAE BORELLA
male, EMERSON, WINKERS, EMERSON WINKERS
female, CADENCE, WEIGT, CADENCE WEIGT
male, ODDIE, MARTUCCIO, ODDIE MARTUCCIO
female, JAYLEN, MACFEE, JAYLEN MACFEE
male, KAYE, SNEDECOR, KAYE SNEDECOR
female, CAMRYN, CARBERRY, CAMRYN CARBERRY
