male, AURTHUR, HOPKINSON, AURTHUR HOPKINSON
female, ANIKA, NOVIK, ANIKA NOVIK
male, EDIE, CIPRIANI, EDIE CIPRIANI
female, ARLETH, MESROBIAN, ARLETH MESROBIAN
male, ROYAL, WEGWERTH, ROYAL WEGWERTH
female, PAISLEY, JAREMA, PAISLEY JAREMA
male, BERTHA, SEDIVEC, BERTHA SEDIVEC
female, WYNONA, KUPER, WYNONA KUPER
male, ULISES, EDINBURGH, ULISES EDINBURGH
female, DOVE, GALLIONE, DOVE GALLIONE
male, COLIN, TWETEN, COLIN TWETEN
female, WHITNEY, SRAN, WHITNEY SRAN
male, EWING, LEVERING, EWING LEVERING
female, MONSERRAT, TRATE, MONSERRAT TRATE
male, TARIQ, CIVITARESE, TARIQ CIVITARESE
female, KENDRA, VAASSEN, KENDRA VAASSEN
male, GREG, PLACZEK, GREG PLACZEK
female, LEESA, REEMTS, LEESA REEMTS
male, WAYMAN, BOBBIO, WAYMAN BOBBIO
female, GRACELYN, GREYTAK, GRACELYN GREYTAK
male, PEARLIE, SANFACON, PEARLIE SANFACON
female, TEXIE, KRSTIC, TEXIE KRSTIC
male, MICHEAL, IDDEEN, MICHEAL IDDEEN
female, GUSTA, DELOTTO, GUSTA DELOTTO
male, BERYL, MINS, BERYL MINS
female, ISABEL, PALETTA, ISABEL PALETTA
male, ROSENDO, MOSQUEA, ROSENDO MOSQUEA
female, SHERILYN, RAPOPORT, SHERILYN RAPOPORT
male, ANDON, FLORIE, ANDON FLORIE
female, HALIE, AHMETOVIC, HALIE AHMETOVIC
male, JUDD, KESER, JUDD KESER
female, VICTORY, ASHCROFT, VICTORY ASHCROFT
male, ROBB, MOVVA, ROBB MOVVA
female, DORTHEA, GAGHAN, DORTHEA GAGHAN
male, PEARLEY, FLOCH, PEARLEY FLOCH
female, MARILOU, JANCZAK, MARILOU JANCZAK
male, HAMILTON, KUNK, HAMILTON KUNK
female, LEOTA, TEGGE, LEOTA TEGGE
male, ALANZO, CHAUEZ, ALANZO CHAUEZ
female, JILL, RISOLO, JILL RISOLO
male, HAROLD, DUNKER, HAROLD DUNKER
female, VIRGINIA, JAISINGHANI, VIRGINIA JAISINGHANI
male, MICHAEL, RAYNAUD, MICHAEL RAYNAUD
female, VALERY, CLEMANS, VALERY CLEMANS
male, ELI, SHANDER, ELI SHANDER
female, TEXANNA, REMP, TEXANNA REMP
male, JAIME, DINE, JAIME DINE
female, AGNES, AHEARNE, AGNES AHEARNE
male, ROLL, PARACHE, ROLL PARACHE
female, GWENDOLYN, DEGRACE, GWENDOLYN DEGRACE
male, GROVE, SANDRIA, GROVE SANDRIA
female, BERENICE, PRANSKY, BERENICE PRANSKY
male, CANYON, KRIPS, CANYON KRIPS
female, ELYSE, GRAUS, ELYSE GRAUS
male, ADRIAN, SHIPLETT, ADRIAN SHIPLETT
female, JEAN, DONNALLEY, JEAN DONNALLEY
male, ANNA, CINO, ANNA CINO
female, TAMALA, KAPPAS, TAMALA KAPPAS
male, NORBERTO, BEAUSOLEIL, NORBERTO BEAUSOLEIL
female, ODETTE, DUFFNER, ODETTE DUFFNER
male, SCHLEY, LEANG, SCHLEY LEANG
female, CELESTIA, NEWLOVE, CELESTIA NEWLOVE
male, WINFORD, KETKAR, WINFORD KETKAR
female, PRICILLA, CARBERT, PRICILLA CARBERT
male, ALPHONSO, ABEEL, ALPHONSO ABEEL
female, RUBYE, DADURA, RUBYE DADURA
male, EPHRAM, CRINGAN, EPHRAM CRINGAN
female, KALYN, SIMONSEN, KALYN SIMONSEN
male, TOBIAS, HUCHKO, TOBIAS HUCHKO
female, BETHZY, HEFLING, BETHZY HEFLING
male, DAMION, VANEYK, DAMION VANEYK
female, SHYLA, KENWOOD, SHYLA KENWOOD
male, BRUNO, FRONCE, BRUNO FRONCE
female, DOVE, ROKOSZ, DOVE ROKOSZ
male, ARRON, HAAGA, ARRON HAAGA
female, KALEENA, ZIESMER, KALEENA ZIESMER
male, LISTON, SALVUCCI, LISTON SALVUCCI
female, SONIA, OWOEYE, SONIA OWOEYE
male, KENJI, WISTER, KENJI WISTER
female, EOLA, FRIX, EOLA FRIX
male, ESTES, LARABELL, ESTES LARABELL
female, BAMA, OGGS, BAMA OGGS
male, DONTA, RAMIG, DONTA RAMIG
female, BRIANA, ALTY, BRIANA ALTY
male, ROLL, PARADINE, ROLL PARADINE
female, CAMMIE, SHUELL, CAMMIE SHUELL
male, JUSTEN, KOHRING, JUSTEN KOHRING
female, BEVERLY, REINERT, BEVERLY REINERT
male, MAE, TUNTLAND, MAE TUNTLAND
female, MICAYLA, PATINELLA, MICAYLA PATINELLA
male, TAVION, HARTQUIST, TAVION HARTQUIST
female, APRIL, CHAMPEAU, APRIL CHAMPEAU
male, DAVEY, VANDEKROL, DAVEY VANDEKROL
female, MARLENE, KARMAZIN, MARLENE KARMAZIN
male, GILES, WARRIOR, GILES WARRIOR
female, EMOGENE, ALEKSICH, EMOGENE ALEKSICH
male, WENDELL, ISAKOV, WENDELL ISAKOV
female, JERRICA, MATTEUCCI, JERRICA MATTEUCCI
male, DAMARCUS, MULET, DAMARCUS MULET
female, KEENA, LEGOWSKI, KEENA LEGOWSKI
male, GANNON, CANNESTRA, GANNON CANNESTRA
female, AMELIE, CORRO, AMELIE CORRO
male, MAX, BLASCH, MAX BLASCH
female, MARYBETH, WHAM, MARYBETH WHAM
male, DURRELL, BONGIORNO, DURRELL BONGIORNO
female, RANDI, WACK, RANDI WACK
male, KENDALL, HOYETT, KENDALL HOYETT
female, GILLIE, PEREZCORTEZ, GILLIE PEREZCORTEZ
male, PAXTON, PILACHOWSKI, PAXTON PILACHOWSKI
female, OLENE, PACHOLSKI, OLENE PACHOLSKI
male, HARVY, ROMULUS, HARVY ROMULUS
female, CARLY, TECUN, CARLY TECUN
male, EDITH, WAWRZYNSKI, EDITH WAWRZYNSKI
female, LATOSHA, SCHOENEMANN, LATOSHA SCHOENEMANN
male, FERRELL, LAMPTON, FERRELL LAMPTON
female, BRIANDA, ELDIN, BRIANDA ELDIN
male, RAYBURN, MEROW, RAYBURN MEROW
female, LOUVENIA, STEETS, LOUVENIA STEETS
male, SOLON, MALLABER, SOLON MALLABER
female, TRINIDAD, STASZEL, TRINIDAD STASZEL
male, JUAN, ZAMPERINI, JUAN ZAMPERINI
female, GOLDIA, SHOATS, GOLDIA SHOATS
male, CLAUDE, EMERIC, CLAUDE EMERIC
female, ANNELIESE, LAGACY, ANNELIESE LAGACY
male, BRODY, AWEIS, BRODY AWEIS
female, SHERLYN, PANETH, SHERLYN PANETH
male, DAMEON, BANASZAK, DAMEON BANASZAK
female, ASHLEE, RAFFAELLI, ASHLEE RAFFAELLI
male, ELWYN, KOLLIAS, ELWYN KOLLIAS
female, NETTIE, HUSAIN, NETTIE HUSAIN
male, CALEB, DERN, CALEB DERN
female, JOSEPH, HOLDORF, JOSEPH HOLDORF
male, RANCE, KORNELE, RANCE KORNELE
female, KEYLA, TAJIBOY, KEYLA TAJIBOY
male, JORDYN, PILLARI, JORDYN PILLARI
female, MAURA, GIEM, MAURA GIEM
male, REBECCA, ONTIVEROS, REBECCA ONTIVEROS
female, EMERALD, SCHUHMANN, EMERALD SCHUHMANN
male, JENNIFER, DRAGOTTA, JENNIFER DRAGOTTA
female, CELESTIA, LASKOWSKI, CELESTIA LASKOWSKI
male, IGNATZ, KOEHLINGER, IGNATZ KOEHLINGER
female, SUNNY, LEHN, SUNNY LEHN
male, JAMAAL, MCMANIMON, JAMAAL MCMANIMON
female, EDWINA, MCELMURRY, EDWINA MCELMURRY
male, PERCY, GRABBER, PERCY GRABBER
female, BEDA, QUEK, BEDA QUEK
male, PAGE, PETAK, PAGE PETAK
female, JAYLYNN, COOMBES, JAYLYNN COOMBES
male, HANK, ADAMSKI, HANK ADAMSKI
female, SALLY, BRODEHL, SALLY BRODEHL
male, TOREY, SHENG, TOREY SHENG
female, EVETTE, AGRO, EVETTE AGRO
male, ARVEL, ANTONAKOS, ARVEL ANTONAKOS
female, BEVERLEE, BOGERT, BEVERLEE BOGERT
male, GAYLORD, CUSH, GAYLORD CUSH
female, CORTNEY, MERWORTH, CORTNEY MERWORTH
male, CHAD, RODAN, CHAD RODAN
female, RAYNA, COLVARD, RAYNA COLVARD
male, ANGUS, BAGCHI, ANGUS BAGCHI
female, SARRAH, RAAEN, SARRAH RAAEN
male, YANCY, ROTTERMAN, YANCY ROTTERMAN
female, TIMOTHY, DAFFRON, TIMOTHY DAFFRON
male, MANLY, SAIGH, MANLY SAIGH
female, MARGRETTA, BRIKHO, MARGRETTA BRIKHO
male, RORY, MICELE, RORY MICELE
female, ARDETH, MATUZA, ARDETH MATUZA
male, HEBERT, BASILONE, HEBERT BASILONE
female, BRYANNA, TEEPLE, BRYANNA TEEPLE
male, ADELBERT, ESH, ADELBERT ESH
female, BROOK, SHCHERBINA, BROOK SHCHERBINA
male, MOISES, TORNEL, MOISES TORNEL
female, META, PENDON, META PENDON
male, BIRT, KRUIZE, BIRT KRUIZE
female, LAVERNE, NAWMAN, LAVERNE NAWMAN
male, STEVE, MILIC, STEVE MILIC
female, LOCKIE, POUNDER, LOCKIE POUNDER
male, YORK, HARBUCK, YORK HARBUCK
female, MABEL, GHARBI, MABEL GHARBI
male, HILLARD, AYRES, HILLARD AYRES
female, JORJA, SAINTJOHN, JORJA SAINTJOHN
male, REGAN, MARKGRAF, REGAN MARKGRAF
female, CHARITY, BAENEN, CHARITY BAENEN
male, ORRIN, WENDELBERGER, ORRIN WENDELBERGER
female, BETTYE, VACCARI, BETTYE VACCARI
male, MOSE, MONDEAU, MOSE MONDEAU
female, MADYSON, DOBIS, MADYSON DOBIS
male, ORLIN, GLIDDEN, ORLIN GLIDDEN
female, AMALIE, NORORI, AMALIE NORORI
male, SHERIDAN, ALFREDO, SHERIDAN ALFREDO
female, TRICIA, KARSTENS, TRICIA KARSTENS
male, MYLES, YETTAW, MYLES YETTAW
female, KAYCEE, YELLING, KAYCEE YELLING
male, RODGER, ARRIZOLA, RODGER ARRIZOLA
female, SARA, COLLIEN, SARA COLLIEN
male, CLAUD, HULIT, CLAUD HULIT
female, DOLLY, BUCCHI, DOLLY BUCCHI
male, ESTON, BROADWAY, ESTON BROADWAY
female, DEB, KIRNON, DEB KIRNON
male, BARTON, GUARINI, BARTON GUARINI
female, DEBBIE, WYSOCKY, DEBBIE WYSOCKY
male, MATIAS, DELIMA, MATIAS DELIMA
female, ROSALINDA, ESTABROOK, ROSALINDA ESTABROOK
male, ZOLLIE, RACCUIA, ZOLLIE RACCUIA
female, EDYTHE, MORCOS, EDYTHE MORCOS
male, GRAYLING, SCHRAMER, GRAYLING SCHRAMER
female, BAILEY, GORAN, BAILEY GORAN
male, KIAN, MARTELLY, KIAN MARTELLY
female, CAPITOLA, ALARDIN, CAPITOLA ALARDIN
male, SHEPHERD, KOWALLIS, SHEPHERD KOWALLIS
female, JOELLA, KIRKCONNELL, JOELLA KIRKCONNELL
male, WINFORD, VELECELA, WINFORD VELECELA
female, ZILLAH, DRESSEN, ZILLAH DRESSEN
male, TOREY, HUGS, TOREY HUGS
female, NELIE, TENEBRUSO, NELIE TENEBRUSO
male, ELMORE, ASCENZO, ELMORE ASCENZO
female, SHANNEN, KELLERMAN, SHANNEN KELLERMAN
male, ARBIE, VANDERHEYDEN, ARBIE VANDERHEYDEN
female, ALEXINA, AGAS, ALEXINA AGAS
male, ARMAN, INCANTALUPO, ARMAN INCANTALUPO
female, RILLIE, CASHDOLLAR, RILLIE CASHDOLLAR
male, DUNCAN, CALO, DUNCAN CALO
female, RENAE, CONKRIGHT, RENAE CONKRIGHT
male, KADE, ANZUALDA, KADE ANZUALDA
female, LEA, PINKAVA, LEA PINKAVA
male, RONALDO, VAUTRIN, RONALDO VAUTRIN
female, SAGE, DIGAL, SAGE DIGAL
male, ELIAS, MENOLD, ELIAS MENOLD
female, JALISSA, ACAR, JALISSA ACAR
male, SHEP, SARAGO, SHEP SARAGO
female, EUNA, DIETTE, EUNA DIETTE
male, SMITH, MALTHANER, SMITH MALTHANER
female, LAVELLE, TELEGA, LAVELLE TELEGA
male, BURREL, LAMBART, BURREL LAMBART
female, WILLIAM, STIDUM, WILLIAM STIDUM
male, FERRIS, KOWATCH, FERRIS KOWATCH
female, AMA, TREVISO, AMA TREVISO
male, BUFORD, LEINEN, BUFORD LEINEN
female, CADENCE, STACHYRA, CADENCE STACHYRA
male, JERMEY, HALTERMAN, JERMEY HALTERMAN
female, SHERITA, MURALI, SHERITA MURALI
male, BILLY, AMICONE, BILLY AMICONE
female, SHANA, SUMMY, SHANA SUMMY
male, SUSIE, COLACE, SUSIE COLACE
female, ZHANE, DARGAY, ZHANE DARGAY
male, GRAVES, LOUDIN, GRAVES LOUDIN
female, CRISTEN, KENARD, CRISTEN KENARD
male, BENJAMEN, PEA, BENJAMEN PEA
female, ADILENE, HODINA, ADILENE HODINA
male, ARI, PHUONG, ARI PHUONG
female, BARBARA, GOANS, BARBARA GOANS
male, BISHOP, WILBERN, BISHOP WILBERN
female, ELMIRE, CORPSTEIN, ELMIRE CORPSTEIN
male, MURRY, TUCCERI, MURRY TUCCERI
female, FLOY, BUNGAY, FLOY BUNGAY
male, JAMARCUS, FRENTZ, JAMARCUS FRENTZ
female, DESTINEY, WEAGLEY, DESTINEY WEAGLEY
male, ANN, SCHWAGERL, ANN SCHWAGERL
female, JETTIE, TAYSON, JETTIE TAYSON
male, BRITT, JIROVEC, BRITT JIROVEC
female, LEYLA, ANDERS, LEYLA ANDERS
male, AMANDA, FREYERMUTH, AMANDA FREYERMUTH
female, MELODEE, FORTKAMP, MELODEE FORTKAMP
male, JEFFEREY, GOULAS, JEFFEREY GOULAS
female, LURA, HARVICK, LURA HARVICK
male, ALLYN, GOLDWIRE, ALLYN GOLDWIRE
female, ARNETTA, LUCINI, ARNETTA LUCINI
male, SILAS, WHYEL, SILAS WHYEL
female, MAFALDA, CHANDRAMOHAN, MAFALDA CHANDRAMOHAN
male, JADEN, MURGAS, JADEN MURGAS
female, TAMEKA, SKOCH, TAMEKA SKOCH
male, MERCER, KOSKELA, MERCER KOSKELA
female, PERRY, WINTERTON, PERRY WINTERTON
male, OTHA, HERBST, OTHA HERBST
female, GAYNELL, BECERA, GAYNELL BECERA
male, MAYO, MYALL, MAYO MYALL
female, JEWELL, RUUD, JEWELL RUUD
male, LONDON, RENNICK, LONDON RENNICK
female, ALYSON, WITTS, ALYSON WITTS
male, KORBIN, MAVENCAMP, KORBIN MAVENCAMP
female, LORETTO, RANKIN, LORETTO RANKIN
male, LAVERN, DAINE, LAVERN DAINE
female, SHANON, HEINSEN, SHANON HEINSEN
male, ODIE, FRANKENBACH, ODIE FRANKENBACH
female, CHELSEA, SPILLER, CHELSEA SPILLER
male, GLYNN, OVED, GLYNN OVED
female, SHAKIRA, COLDSMITH, SHAKIRA COLDSMITH
male, MORTIMER, ENDERS, MORTIMER ENDERS
female, FRANC, TREVARROW, FRANC TREVARROW
male, GREGORY, CLEER, GREGORY CLEER
female, IZA, SPASOJEVIC, IZA SPASOJEVIC
male, DARRIEN, BUSEY, DARRIEN BUSEY
female, MARGARETT, HEVERON, MARGARETT HEVERON
male, GUSTAVUS, LOOKABILL, GUSTAVUS LOOKABILL
female, JACQUELYN, SYDENSTRICKER, JACQUELYN SYDENSTRICKER
male, GABE, BAKAITIS, GABE BAKAITIS
female, TOM, BENKEN, TOM BENKEN
male, FRANKLYN, LENCE, FRANKLYN LENCE
female, ABIGALE, MENEZ, ABIGALE MENEZ
male, LILLIAN, NEMCHEK, LILLIAN NEMCHEK
female, ALLEEN, HOVEN, ALLEEN HOVEN
male, MART, PALANZA, MART PALANZA
female, DELCIE, HARFORD, DELCIE HARFORD
male, TRISTIAN, FLOOD, TRISTIAN FLOOD
female, SUZY, DORATHY, SUZY DORATHY
male, GRANVILLE, LANSDOWNE, GRANVILLE LANSDOWNE
female, AIYANA, POLSKY, AIYANA POLSKY
male, EDWARDO, TAMBORSKI, EDWARDO TAMBORSKI
female, ESMERALDA, LICKING, ESMERALDA LICKING
male, LISTON, WALTOWER, LISTON WALTOWER
female, SYBLE, MUJKIC, SYBLE MUJKIC
male, HAYS, RIDGELY, HAYS RIDGELY
female, CALLA, MARSON, CALLA MARSON
male, ALEX, MALLARI, ALEX MALLARI
female, AMMIE, MCJUNKIN, AMMIE MCJUNKIN
male, BUD, TALAREK, BUD TALAREK
female, EBONI, VERNATTER, EBONI VERNATTER
male, JAHIEM, SPANGLE, JAHIEM SPANGLE
female, SYLVA, SAFAEI, SYLVA SAFAEI
male, JENNIE, BELLOMO, JENNIE BELLOMO
female, DULCE, SIDMAN, DULCE SIDMAN
male, JESUS, CALLEWAERT, JESUS CALLEWAERT
female, FILOMENA, BERRIS, FILOMENA BERRIS
male, DANIELLE, BOEHNEN, DANIELLE BOEHNEN
female, WINNIFRED, CONTOS, WINNIFRED CONTOS
male, ANTHONEY, SYMANIETZ, ANTHONEY SYMANIETZ
female, ANIE, KORPICS, ANIE KORPICS
male, TEDDIE, LACARIA, TEDDIE LACARIA
female, ELEANORA, MCVITTIE, ELEANORA MCVITTIE
male, KEGAN, KINTZELE, KEGAN KINTZELE
female, ORENE, MONHEIT, ORENE MONHEIT
male, OBIE, GLAND, OBIE GLAND
female, SIGRID, IBACH, SIGRID IBACH
male, BENJI, FULINARA, BENJI FULINARA
female, JERALDINE, RUBBO, JERALDINE RUBBO
male, GUSSIE, PANTALEONE, GUSSIE PANTALEONE
female, SHANA, CRACCO, SHANA CRACCO
male, CONWAY, DELZEITH, CONWAY DELZEITH
female, LINDA, MOORHEAD, LINDA MOORHEAD
male, ROLL, HEGYI, ROLL HEGYI
female, DEEANN, PORK, DEEANN PORK
male, MARLYN, VERHULST, MARLYN VERHULST
female, OLEVIA, NIGRELLI, OLEVIA NIGRELLI
male, HARDIE, ROBEN, HARDIE ROBEN
female, BRIDGETT, FLUHR, BRIDGETT FLUHR
male, MARTIN, BILLIMORIA, MARTIN BILLIMORIA
female, NOMA, RODONI, NOMA RODONI
male, CLEMENCE, MOTTERSHEAD, CLEMENCE MOTTERSHEAD
female, MARGUERITTA, MCCOTTRELL, MARGUERITTA MCCOTTRELL
male, STACEY, ACIDERA, STACEY ACIDERA
female, KIZZY, ADAMCZAK, KIZZY ADAMCZAK
male, CLEMON, SONA, CLEMON SONA
female, TERA, DOMIER, TERA DOMIER
male, GENARO, WYTASKE, GENARO WYTASKE
female, AKIRA, KERTH, AKIRA KERTH
male, ABRAM, REVENAUGH, ABRAM REVENAUGH
female, GILLIE, SOIGNET, GILLIE SOIGNET
male, REGIS, DANGERFIELD, REGIS DANGERFIELD
female, TAWNY, GODSON, TAWNY GODSON
male, EPHRIAM, HULTING, EPHRIAM HULTING
female, SHAWN, GARDER, SHAWN GARDER
male, DRURY, LUKASIAK, DRURY LUKASIAK
female, DAKOTA, USKO, DAKOTA USKO
male, JOHNNY, ROETHEMEYER, JOHNNY ROETHEMEYER
female, CIARRA, RORABACK, CIARRA RORABACK
male, WHEELER, CHARGIN, WHEELER CHARGIN
female, CLEMIE, SORN, CLEMIE SORN
male, HARLIE, GIBBAR, HARLIE GIBBAR
female, CRESSIE, WOODARD, CRESSIE WOODARD
male, IKE, ONYEKWERE, IKE ONYEKWERE
female, NEVADA, OESCH, NEVADA OESCH
male, FATE, NORTHROP, FATE NORTHROP
female, DALIA, OSWALT, DALIA OSWALT
male, NORTH, BOCCHIERI, NORTH BOCCHIERI
female, ARIETTA, GILLIT, ARIETTA GILLIT
male, JERAMY, LEINBACH, JERAMY LEINBACH
female, OTA, TEPEDINO, OTA TEPEDINO
male, HOLLIE, DIBISCEGLIE, HOLLIE DIBISCEGLIE
female, ROXY, GUSTAVSEN, ROXY GUSTAVSEN
male, LIONEL, OCHSENHIRT, LIONEL OCHSENHIRT
female, SUSSIE, SWINDALL, SUSSIE SWINDALL
male, BRANT, RICKLIN, BRANT RICKLIN
female, ROY, SAUERWINE, ROY SAUERWINE
male, TRAYVON, JANSKY, TRAYVON JANSKY
female, MARILLA, VAGEDES, MARILLA VAGEDES
male, TAJ, CHABRA, TAJ CHABRA
female, TRESSIE, RHAME, TRESSIE RHAME
male, ATHA, KALINKA, ATHA KALINKA
female, JOHANNAH, HANGEN, JOHANNAH HANGEN
male, BILLY, BARBEY, BILLY BARBEY
female, DESTANY, DIERKHISING, DESTANY DIERKHISING
male, ERASMUS, VALETIN, ERASMUS VALETIN
female, SONJI, GOTTMAN, SONJI GOTTMAN
male, JASE, STOPERA, JASE STOPERA
female, ANGELIC, FREKING, ANGELIC FREKING
male, OSSIE, HANDRAHAN, OSSIE HANDRAHAN
female, JAZLENE, TAIRA, JAZLENE TAIRA
male, ERBY, VALL, ERBY VALL
female, CHRYSTAL, SHACKLETON, CHRYSTAL SHACKLETON
male, BRYCE, RANDLEMAN, BRYCE RANDLEMAN
female, ELAINA, FERRAO, ELAINA FERRAO
male, ARMAN, BOSANAC, ARMAN BOSANAC
female, FELICIE, POTE, FELICIE POTE
male, RAQUAN, PUVOGEL, RAQUAN PUVOGEL
female, ELMINA, GRANDPRE, ELMINA GRANDPRE
male, ELTON, MCSHAW, ELTON MCSHAW
female, AMALIE, SCHALOW, AMALIE SCHALOW
male, VERLYN, KIENHOLZ, VERLYN KIENHOLZ
female, JANN, KAMIMOTO, JANN KAMIMOTO
male, RAYFORD, DRAWHORN, RAYFORD DRAWHORN
female, FATIMA, NACARATO, FATIMA NACARATO
male, LYRIC, PECHARICH, LYRIC PECHARICH
female, KALLIE, WILDRICK, KALLIE WILDRICK
male, BLISS, PARRAM, BLISS PARRAM
female, ETHER, BRAESCH, ETHER BRAESCH
male, GEROLD, CALIP, GEROLD CALIP
female, HEDY, POPOLA, HEDY POPOLA
male, RUBIN, FILIPOVIC, RUBIN FILIPOVIC
female, LAVELLE, ROCHIN, LAVELLE ROCHIN
male, DARREL, PLESNIAK, DARREL PLESNIAK
female, SHAWNA, VITONE, SHAWNA VITONE
male, RONALD, RAPAGLIA, RONALD RAPAGLIA
female, CHRISTENA, BANASZEWSKI, CHRISTENA BANASZEWSKI
male, WALDO, ZEIDAN, WALDO ZEIDAN
female, DANNA, HIBBLER, DANNA HIBBLER
male, TORRENCE, YASUDA, TORRENCE YASUDA
female, DONIA, PASIK, DONIA PASIK
male, JERE, FIRESTEIN, JERE FIRESTEIN
female, CLEMMIE, HALFACRE, CLEMMIE HALFACRE
male, VALENTIN, CASTORO, VALENTIN CASTORO
female, DANIEL, AXLER, DANIEL AXLER
male, REGIS, BOSKO, REGIS BOSKO
female, ARELI, WINTHEISER, ARELI WINTHEISER
male, EARLEY, KLAPROTH, EARLEY KLAPROTH
female, CHARLEEN, GEE, CHARLEEN GEE
male, LENNY, DOROTEO, LENNY DOROTEO
female, HETTY, COFFLAND, HETTY COFFLAND
male, HAIDEN, BOVERO, HAIDEN BOVERO
female, ARLYNE, HYDARA, ARLYNE HYDARA
male, JULIO, SCHMECHEL, JULIO SCHMECHEL
female, BEVERLEY, EVILSIZER, BEVERLEY EVILSIZER
male, SKYLER, FAGOT, SKYLER FAGOT
female, ABRIL, WOJENSKI, ABRIL WOJENSKI
male, ALONSO, ORLOVA, ALONSO ORLOVA
female, MOESHA, SIKANDAR, MOESHA SIKANDAR
male, DAMARCUS, KOLLMAR, DAMARCUS KOLLMAR
female, MAYME, ZETINA, MAYME ZETINA
male, BERNHARD, FLAGSTAD, BERNHARD FLAGSTAD
female, CHAYA, KURIYAMA, CHAYA KURIYAMA
male, FORREST, CONTARDO, FORREST CONTARDO
female, AMY, TANGHAL, AMY TANGHAL
male, JOSEPH, DOINO, JOSEPH DOINO
female, ELEANORE, WESNEY, ELEANORE WESNEY
male, HUNT, RINGWALD, HUNT RINGWALD
female, SUMMER, NGO, SUMMER NGO
male, BRAYLEN, JIMMERSON, BRAYLEN JIMMERSON
female, JULIANNE, TE, JULIANNE TE
male, CLEMENS, GLAB, CLEMENS GLAB
female, KATY, AGUILARMARTINE, KATY AGUILARMARTINE
male, DUARD, LESSANE, DUARD LESSANE
female, JAILYN, GENUNG, JAILYN GENUNG
male, TYRIK, SCHATTEL, TYRIK SCHATTEL
female, HANNAH, GRODEN, HANNAH GRODEN
male, DIMITRI, LECKELT, DIMITRI LECKELT
female, LOVE, MENSINGER, LOVE MENSINGER
male, YAEL, MCCOGGLE, YAEL MCCOGGLE
female, KANISHA, PILIPCHUK, KANISHA PILIPCHUK
male, CLAUDIO, ANDERWALD, CLAUDIO ANDERWALD
female, MOIRA, CRITCHLOW, MOIRA CRITCHLOW
male, ADDISON, LOHRE, ADDISON LOHRE
female, CELESTINE, PETTIBONE, CELESTINE PETTIBONE
male, OBIE, SHAAR, OBIE SHAAR
female, TERA, LINNEMEIER, TERA LINNEMEIER
male, DEONTAE, MABROUK, DEONTAE MABROUK
female, OTTIE, VANDONSELAAR, OTTIE VANDONSELAAR
male, GARRETT, RUSCITTO, GARRETT RUSCITTO
female, MELBA, JAGROOP, MELBA JAGROOP
male, ALOYS, FLADD, ALOYS FLADD
female, JAIME, GELOSO, JAIME GELOSO
male, COLIN, RAGBIR, COLIN RAGBIR
female, JANIS, ISEMAN, JANIS ISEMAN
male, DWAIN, GRITZ, DWAIN GRITZ
female, JAMYA, SNOEK, JAMYA SNOEK
male, KHALIL, NICHELSON, KHALIL NICHELSON
female, EMMALINE, BATTICE, EMMALINE BATTICE
male, RAHEEM, FLYNN, RAHEEM FLYNN
female, FRANKIE, WINQUIST, FRANKIE WINQUIST
male, WYLIE, BARTLING, WYLIE BARTLING
female, KRISSY, MERCIL, KRISSY MERCIL
male, DELL, PERSCHKE, DELL PERSCHKE
female, KATHERINE, GENTEMANN, KATHERINE GENTEMANN
male, JOYCE, GRAYTON, JOYCE GRAYTON
female, DOROTHY, KARLSSON, DOROTHY KARLSSON
male, ALWIN, WALKERSMITH, ALWIN WALKERSMITH
female, KARLY, CABBAGE, KARLY CABBAGE
male, COLIE, CANDIANO, COLIE CANDIANO
female, DEBORAH, PASKA, DEBORAH PASKA
male, VIRGIL, SINACORI, VIRGIL SINACORI
female, NILDA, BAULEKE, NILDA BAULEKE
male, MARTIN, PELSOR, MARTIN PELSOR
female, RYAN, REFFITT, RYAN REFFITT
male, ORAL, TELO, ORAL TELO
female, KAIYA, HISER, KAIYA HISER
male, WINFORD, HARRILL, WINFORD HARRILL
female, HAILIE, HAPE, HAILIE HAPE
male, ANANIAS, HARSHBERGER, ANANIAS HARSHBERGER
female, JOSETTE, DEAROLF, JOSETTE DEAROLF
male, ZED, INNS, ZED INNS
female, DORTHY, EVANGELISTA, DORTHY EVANGELISTA
male, CHESTER, RASULO, CHESTER RASULO
female, LULA, BRESEE, LULA BRESEE
male, MAUDE, MERACLE, MAUDE MERACLE
female, DRUSILLA, SCHROBILGEN, DRUSILLA SCHROBILGEN
male, CASSIDY, PAPIN, CASSIDY PAPIN
female, ROMAINE, ASWEGAN, ROMAINE ASWEGAN
male, LUIGI, TACKIE, LUIGI TACKIE
female, MARTINE, EVERTS, MARTINE EVERTS
male, RUDY, GRUESBECK, RUDY GRUESBECK
female, SIGRID, KUERSCHNER, SIGRID KUERSCHNER
male, GRANVILLE, BRUSH, GRANVILLE BRUSH
female, WILLA, PHIN, WILLA PHIN
male, BOBBIE, GOLUBSKI, BOBBIE GOLUBSKI
female, AMBERLY, SHUTA, AMBERLY SHUTA
male, KING, ARMOGAN, KING ARMOGAN
female, DANYELL, PRUCNAL, DANYELL PRUCNAL
male, JEWELL, MURAMATSU, JEWELL MURAMATSU
female, NIKKI, SUREZ, NIKKI SUREZ
male, AUDREY, LIEBSCHER, AUDREY LIEBSCHER
female, COLETTA, NAIMOLI, COLETTA NAIMOLI
male, CAIDEN, QUINNELLY, CAIDEN QUINNELLY
female, VICTORIA, AARSVOLD, VICTORIA AARSVOLD
male, TRAYVON, GRAVANTE, TRAYVON GRAVANTE
female, ELNA, HEYN, ELNA HEYN
male, GUSTAF, KALTMAN, GUSTAF KALTMAN
female, EARLEAN, CELSO, EARLEAN CELSO
male, JAMIN, CHUMPITAZ, JAMIN CHUMPITAZ
female, MELVIN, NUNEZLOPEZ, MELVIN NUNEZLOPEZ
male, TOM, KONZ, TOM KONZ
female, DELORES, SCHANZENBACH, DELORES SCHANZENBACH
male, WINTHROP, ARFLIN, WINTHROP ARFLIN
female, REANNA, DODE, REANNA DODE
male, MITCHEL, VEN, MITCHEL VEN
female, JESSYE, PAVELL, JESSYE PAVELL
male, TERELL, MABEY, TERELL MABEY
female, RICHARD, MONTILLO, RICHARD MONTILLO
male, OCTAVE, MEINTS, OCTAVE MEINTS
female, KATHYRN, LIMATO, KATHYRN LIMATO
male, BOYD, MARZIANI, BOYD MARZIANI
female, HULDAH, SIOK, HULDAH SIOK
male, DORMAN, MCFARQUHAR, DORMAN MCFARQUHAR
female, RONDA, LOURY, RONDA LOURY
male, WHIT, NAVID, WHIT NAVID
female, JOANIE, HANABURGH, JOANIE HANABURGH
male, KIYOSHI, ARNIERI, KIYOSHI ARNIERI
female, STEPHENIE, DAVION, STEPHENIE DAVION
male, ALFORD, BREITEN, ALFORD BREITEN
female, ROLANDA, MRUZ, ROLANDA MRUZ
male, MILTON, AKINYEMI, MILTON AKINYEMI
female, QUINN, MOTTL, QUINN MOTTL
male, COLEY, CARMACK, COLEY CARMACK
female, KARRIE, DINKENS, KARRIE DINKENS
male, RAHSAAN, SKEANS, RAHSAAN SKEANS
female, KAYA, DAVDA, KAYA DAVDA
male, HAMILTON, GLINSMANN, HAMILTON GLINSMANN
female, CHRISSIE, PHILIPP, CHRISSIE PHILIPP
male, LUCIANO, ROSAUER, LUCIANO ROSAUER
female, WILDA, JETTER, WILDA JETTER
male, CHAUNCEY, KAMPERT, CHAUNCEY KAMPERT
female, ARDELLA, FRANZOY, ARDELLA FRANZOY
male, BARNIE, NEVAREZ, BARNIE NEVAREZ
female, GENEVIEVE, BATTINO, GENEVIEVE BATTINO
male, WINFIELD, LANOS, WINFIELD LANOS
female, CONNIE, WELLENDORF, CONNIE WELLENDORF
male, TIMMY, SARGENT, TIMMY SARGENT
female, SHAWNDA, LIVSEY, SHAWNDA LIVSEY
male, TAYLOR, MENGERS, TAYLOR MENGERS
female, NELIA, RAZIN, NELIA RAZIN
male, GANNON, MAGRANN, GANNON MAGRANN
female, BRANDY, ZISKIN, BRANDY ZISKIN
male, KARIM, TYNDALE, KARIM TYNDALE
female, MADONNA, AUGUILLARD, MADONNA AUGUILLARD
male, TYRESE, LAFKO, TYRESE LAFKO
female, DELOIS, BERGMARK, DELOIS BERGMARK
male, THOMAS, DYKEMA, THOMAS DYKEMA
female, ROXANN, ONOFREI, ROXANN ONOFREI
male, LYLE, DARRIGO, LYLE DARRIGO
female, NATOSHA, BONFIELD, NATOSHA BONFIELD
male, JAYDEN, GROVE, JAYDEN GROVE
female, STARR, SPARMAN, STARR SPARMAN
male, BUNK, GEILING, BUNK GEILING
female, ADELAIDE, ENGLEKING, ADELAIDE ENGLEKING
male, WAYLAND, LITZINGER, WAYLAND LITZINGER
female, ANGELINE, BENETTE, ANGELINE BENETTE
male, NUNZIO, SOULSBY, NUNZIO SOULSBY
female, CARMELITA, PEWO, CARMELITA PEWO
male, HILL, KEINER, HILL KEINER
female, BERTA, GAUTHE, BERTA GAUTHE
male, MATTHIAS, PAETH, MATTHIAS PAETH
female, CAROLYNE, MORIGEAU, CAROLYNE MORIGEAU
male, ALPHONSUS, KESINGER, ALPHONSUS KESINGER
female, SOPHIA, CELENTANO, SOPHIA CELENTANO
male, CORDARO, FASSL, CORDARO FASSL
female, LONNIE, VANDERTIE, LONNIE VANDERTIE
male, DICKIE, HOBENSACK, DICKIE HOBENSACK
female, ROSAMOND, TALE, ROSAMOND TALE
male, JEREMY, SCHNITKER, JEREMY SCHNITKER
female, ALTHA, WEEKES, ALTHA WEEKES
male, ELTON, HANKO, ELTON HANKO
female, CONNIE, OBRYON, CONNIE OBRYON
male, BRENNEN, VECCIA, BRENNEN VECCIA
female, AISHA, DEGG, AISHA DEGG
male, CECIL, SHULSE, CECIL SHULSE
female, TANJA, PREDMORE, TANJA PREDMORE
male, JAIR, HERPEL, JAIR HERPEL
female, CATRINA, JILLSON, CATRINA JILLSON
male, ARNULFO, BALADO, ARNULFO BALADO
female, SHARYN, LEHTO, SHARYN LEHTO
male, ALONZO, ELIDRISSI, ALONZO ELIDRISSI
female, MARGARETTE, EDMISTER, MARGARETTE EDMISTER
male, CALHOUN, FURBEE, CALHOUN FURBEE
female, CORAL, HAILSTOCK, CORAL HAILSTOCK
male, TYSON, MACHECA, TYSON MACHECA
female, SKYLA, DIANA, SKYLA DIANA
male, BUDDY, CONSTANTINO, BUDDY CONSTANTINO
female, WILLIAM, MAGILL, WILLIAM MAGILL
male, EMMANUEL, SZUBA, EMMANUEL SZUBA
female, GAIL, MORRONE, GAIL MORRONE
male, KAREEN, MERLUZZI, KAREEN MERLUZZI
female, LISBETH, BOLDT, LISBETH BOLDT
male, LUVERNE, SADANA, LUVERNE SADANA
female, JERRICA, HASON, JERRICA HASON
male, VON, SCHEIHING, VON SCHEIHING
female, JAMIYA, WOLKING, JAMIYA WOLKING
male, FRANCES, DORIUS, FRANCES DORIUS
female, ALTA, FONTAINE, ALTA FONTAINE
male, AYDIN, RAITHEL, AYDIN RAITHEL
female, KAMRYN, JEZAK, KAMRYN JEZAK
male, TARIK, LALENA, TARIK LALENA
female, LOUISA, CALLACI, LOUISA CALLACI
male, CHADWICK, VAGTS, CHADWICK VAGTS
female, ANABEL, TROMBATORE, ANABEL TROMBATORE
male, THELMA, SAIENNI, THELMA SAIENNI
female, MADELYNN, YELICH, MADELYNN YELICH
male, ZIGMUND, FLENORY, ZIGMUND FLENORY
female, KATHALEEN, LISENBEE, KATHALEEN LISENBEE
male, CLINTON, HOLMEN, CLINTON HOLMEN
female, JILLIAN, WARCHAL, JILLIAN WARCHAL
male, HORACIO, PEVELER, HORACIO PEVELER
female, SHANTA, SMOLKA, SHANTA SMOLKA
male, BABYBOY, NISANOV, BABYBOY NISANOV
female, CHLOE, KITCHER, CHLOE KITCHER
male, LOU, VORRASI, LOU VORRASI
female, DORINDA, OTTATI, DORINDA OTTATI
male, EDMOND, BARTES, EDMOND BARTES
female, ELBA, HOCHREIN, ELBA HOCHREIN
male, NIKOLAI, SMALLING, NIKOLAI SMALLING
female, LAVONA, MCLERNON, LAVONA MCLERNON
male, BUEL, ZADRA, BUEL ZADRA
female, INGRID, PANGELINA, INGRID PANGELINA
male, ORLO, WALKOWSKI, ORLO WALKOWSKI
female, AUDRIANNA, MOELLERS, AUDRIANNA MOELLERS
male, DARRIUS, KRULA, DARRIUS KRULA
female, EVELINE, LANDEN, EVELINE LANDEN
